-- Adminer 3.6.1 MySQL dump

SET NAMES utf8;
SET foreign_key_checks = 0;
SET time_zone = 'SYSTEM';
SET sql_mode = 'NO_AUTO_VALUE_ON_ZERO';

DROP TABLE IF EXISTS `builds`;
CREATE TABLE `builds` (
  `buiId` int(11) NOT NULL AUTO_INCREMENT,
  `buiName` varchar(64) CHARACTER SET utf8 COLLATE utf8_bin NOT NULL,
  `buiSafename` varchar(64) CHARACTER SET utf8 COLLATE utf8_bin NOT NULL,
  `buiCreated` datetime NOT NULL,
  `buiModified` datetime NOT NULL,
  `buiTemplate` varchar(64) CHARACTER SET utf8 COLLATE utf8_bin NOT NULL,
  `buiFile` varchar(64) CHARACTER SET utf8 COLLATE utf8_bin NOT NULL,
  `buiVersion` varchar(64) CHARACTER SET utf8 COLLATE utf8_bin NOT NULL,
  `buiBuildNum` varchar(16) CHARACTER SET utf8 COLLATE utf8_bin NOT NULL,
  `buiChangeLog` text CHARACTER SET utf8 COLLATE utf8_bin NOT NULL,
  `buiProIdFK` int(11) NOT NULL,
  `buiCerIdFK` int(11) DEFAULT NULL,
  `buiType` tinyint(1) NOT NULL DEFAULT '0',
  `buiBuildType` varchar(255) NOT NULL,
  `buiApple` varchar(64) CHARACTER SET utf8 COLLATE utf8_bin NOT NULL,
  `buiSVN` varchar(64) CHARACTER SET utf8 COLLATE utf8_bin NOT NULL,
  `buiFeedUrl` varchar(128) CHARACTER SET utf8 COLLATE utf8_bin NOT NULL,
  `buiVisibleClient` tinyint(1) NOT NULL DEFAULT '1',
  `buiDeviceOS` tinyint(1) NOT NULL DEFAULT '0',
  `buiLimitedUDID` tinyint(1) NOT NULL DEFAULT '0',
  `buiBundleIdentifier` varchar(128) CHARACTER SET utf8 COLLATE utf8_bin NOT NULL,
  `buiHash` varchar(16) CHARACTER SET latin1 NOT NULL,
  `buiFav` tinyint(1) DEFAULT NULL,
  `buiSendEmail` int(11) DEFAULT NULL,
  `created_by` int(11) DEFAULT NULL,
  `created_at` int(11) DEFAULT NULL,
  `updated_at` int(11) DEFAULT NULL,
  PRIMARY KEY (`buiId`),
  UNIQUE KEY `buiHash` (`buiHash`),
  KEY `buiProIdFK` (`buiProIdFK`),
  KEY `created_by` (`created_by`),
  CONSTRAINT `builds_ibfk_3` FOREIGN KEY (`buiProIdFK`) REFERENCES `ota_projects` (`id`) ON DELETE NO ACTION,
  CONSTRAINT `builds_ibfk_4` FOREIGN KEY (`created_by`) REFERENCES `user` (`id`) ON DELETE NO ACTION
) ENGINE=InnoDB DEFAULT CHARSET=utf8;

INSERT INTO `builds` (`buiId`, `buiName`, `buiSafename`, `buiCreated`, `buiModified`, `buiTemplate`, `buiFile`, `buiVersion`, `buiBuildNum`, `buiChangeLog`, `buiProIdFK`, `buiCerIdFK`, `buiType`, `buiBuildType`, `buiApple`, `buiSVN`, `buiFeedUrl`, `buiVisibleClient`, `buiDeviceOS`, `buiLimitedUDID`, `buiBundleIdentifier`, `buiHash`, `buiFav`, `buiSendEmail`, `created_by`, `created_at`, `updated_at`) VALUES
(1039,	'Testing ota',	'testing-ota',	'2012-06-15 13:52:27',	'2012-07-17 09:50:12',	'0',	'/1039.ipa',	'test3.2',	'',	'',	1035,	0,	0,	'Alternative',	'tech@mobgen.com',	'',	'http://shellinno.mobgen.com',	1,	0,	0,	'com.mobgen.shellinnovation',	'kyn5ctevvom3',	0,	NULL,	1,	1339761147,	1342511412),
(1041,	'Shell Investor Media 1.3',	'shell-investor-media-1-3',	'2012-06-19 16:06:56',	'2012-06-19 16:06:56',	'0',	'/1041.ipa',	'1906',	'',	'',	1292,	0,	0,	'Alternative',	'tech@mobgen.com',	'',	'http://shell-alt.mobgen.com',	1,	0,	0,	'com.mobgen.shellinvestormedia',	'ev55qcecu0v',	0,	NULL,	1,	1340114816,	1340114816),
(1042,	'ShellInnovation',	'shellinnovation',	'2012-06-19 17:47:18',	'2012-06-19 18:10:38',	'2',	'/1042.ipa',	'1.3.24-783',	'',	'',	1035,	0,	0,	'Alternative',	'tech@mobgen.com',	'',	'http://shellinno-alt.mobgen.com',	1,	0,	0,	'com.mobgen.shellinnovation',	'oyoh87ihuk9w',	0,	NULL,	1,	1340120838,	1340122238),
(1043,	'ShellInnovation',	'shellinnovation',	'2012-06-26 14:42:11',	'2012-06-26 14:42:11',	'2',	'/1043.ipa',	'1.3.24-784',	'',	'',	1035,	0,	0,	'Production',	'tech@mobgen.com',	'',	'http://shellinno-alt.mobgen.com',	1,	0,	0,	'com.mobgen.shellinnovation',	'e0az897brxz6',	0,	NULL,	1,	1340714531,	1340714531),
(1044,	'ShellInnovation',	'shellinnovation',	'2012-06-26 15:11:32',	'2012-06-26 15:56:47',	'2',	'/1044.ipa',	'1.3.24-786',	'',	'',	1035,	0,	0,	'Production',	'tech@mobgen.com',	'',	'http://shellinno.mobgen.com',	1,	0,	0,	'com.mobgen.shellinnovation',	'oafwb9bzm4ax',	0,	NULL,	1,	1340716292,	1340719007),
(1045,	'Shell Investor Media',	'shell-investor-media',	'2012-06-27 15:23:02',	'2012-06-29 10:43:57',	'2',	'/1045.ipa',	'1.2.5 327',	'',	'',	1292,	0,	0,	'Production',	'tech@mobgen.com',	'',	'http://shell-dev.mobgen.com',	1,	0,	0,	'com.mobgen.shellinvestormedia',	'yn6gc2kwi7f8',	0,	NULL,	1,	1340803382,	1340959437),
(1046,	'Lifespotters 2012-07-05',	'lifespotters-2012-07-05',	'2012-07-05 15:49:41',	'2012-07-05 15:49:41',	'0',	'/1046.ipa',	'r14',	'',	'',	2680,	0,	0,	'development',	'apple@mobgen.com',	'',	'http://-alt.mobgen.com',	1,	0,	0,	'com.mobgen.lifespottersenterprise',	'fd2ls1cwqrv',	0,	NULL,	1,	1341496181,	1341496181),
(1047,	'Shell IR',	'shell-ir',	'2012-07-06 16:05:12',	'2012-07-06 16:06:20',	'0',	'/1047.apk',	'1.4.4',	'',	'',	1292,	0,	0,	'Production',	'',	'',	'http://-alt.mobgen.com',	1,	1,	0,	'com.mobgen.shellir',	'mcfw9uvbe6r',	0,	NULL,	1,	1341583512,	1341583580),
(1049,	'Lifespotters 2012-07-16',	'lifespotters-2012-07-16',	'2012-07-16 13:21:34',	'2012-07-16 13:21:34',	'0',	'/1049.ipa',	'r18',	'',	'',	2680,	0,	0,	'development',	'apple@mobgen.com',	'',	'http://-alt.mobgen.com',	1,	0,	0,	'com.mobgen.lifespottersenterprise',	'd2ljgsfo6cop',	0,	NULL,	1,	1342437694,	1342437694),
(1050,	'Test app',	'test-app',	'2012-07-17 10:51:08',	'2012-07-17 11:10:37',	'2',	'/1050.ipa',	'1.1.1.1',	'',	'test',	1035,	0,	0,	'Production',	'apple@mobgen.com',	'',	'http://-alt.mobgen.com',	0,	0,	0,	'com.mobgen.shellinnovation',	'zdfhlgo1t5cs',	0,	NULL,	1,	1342515068,	1342516237),
(1051,	'Lifespotters 2012-07-19',	'lifespotters-2012-07-19',	'2012-07-19 13:03:16',	'2012-07-19 13:03:16',	'0',	'/1051.ipa',	'r19',	'',	'',	2680,	0,	0,	'development',	'apple@mobgen.com',	'',	'http://-alt.mobgen.com',	1,	0,	0,	'com.mobgen.lifespottersenterprise',	'04o0lhxevhk',	0,	NULL,	1,	1342695796,	1342695796),
(1052,	'23.07',	'23-07',	'2012-07-24 14:17:41',	'2012-09-06 13:40:10',	'0',	'/1052.ipa',	'23.07',	'',	'this a test',	1549,	0,	0,	'',	'apple@mobgen.com',	'',	'http://-alt.mobgen.com',	1,	0,	1,	'com.piccolo.bookstore.world',	'i3zbrx9gps2x',	0,	NULL,	1,	1343132261,	1346931610),
(1053,	'Lifespotters 2012-07-27',	'lifespotters-2012-07-27',	'2012-07-27 15:52:10',	'2012-07-27 15:52:24',	'0',	'/1053.ipa',	'r20',	'',	'',	2680,	0,	0,	'development',	'apple@mobgen.com',	'',	'http://-alt.mobgen.com',	1,	0,	0,	'com.mobgen.lifespottersenterprise',	'yf7qrxm7luwb',	0,	NULL,	1,	1343397130,	1343397144),
(1054,	'Lifespotters 2012-07-27',	'lifespotters-2012-07-27',	'2012-07-27 15:52:56',	'2012-07-27 15:53:04',	'0',	'/1054.ipa',	'r21',	'',	'',	2680,	0,	0,	'development',	'apple@mobgen.com',	'',	'http://-alt.mobgen.com',	1,	0,	0,	'com.mobgen.lifespottersenterprise',	'q0wxdpnumca',	0,	NULL,	1,	1343397176,	1343397184),
(1056,	'VL 2012-08-16',	'vl-2012-08-16',	'2012-08-16 14:00:04',	'2012-08-16 14:00:04',	'0',	'/1056.ipa',	'',	'',	'',	2680,	0,	0,	'debug',	'',	'',	'http://-alt.mobgen.com',	1,	0,	0,	'com.mobgen.vanlanschot',	'sz9ddiv3zpi',	0,	NULL,	1,	1345118404,	1345118404),
(1057,	'Shell Innovation',	'shell-innovation',	'2012-08-16 18:03:55',	'2012-08-20 12:16:53',	'2',	'/1057.ipa',	'1.3.24 788',	'',	'',	1035,	0,	0,	'Production',	'tech@mobgen.com',	'',	'http://shellinno.mobgen.com',	1,	0,	0,	'com.mobgen.shellinnovation',	'5v8bfiaa40wp',	0,	NULL,	1,	1345133035,	1345457813),
(1058,	'Shell Innovation',	'shell-innovation',	'2012-08-20 12:11:48',	'2012-08-20 12:11:48',	'2',	'/1058.ipa',	'1.3.24 789',	'',	'',	1035,	0,	0,	'Alternative',	'apple@mobgen.com',	'',	'http://shellinno-alt.mobgen.com',	1,	0,	0,	'com.mobgen.shellinnovation',	'd8nxi3vohufp',	1,	NULL,	1,	1345457508,	1452874223),
(1059,	'Shell Innovation',	'shell-innovation',	'2012-08-20 12:13:28',	'2012-08-20 12:14:46',	'2',	'/1059.ipa',	'1.3.24 790',	'',	'',	1035,	0,	0,	'Production',	'',	'',	'http://shellinno.mobgen.com',	1,	0,	0,	'com.mobgen.shellinnovation',	'70dcs0zttgs',	0,	NULL,	1,	1345457608,	1345457686),
(1060,	'Lifespotters 2012-08-21',	'lifespotters-2012-08-21',	'2012-08-21 15:41:55',	'2012-08-21 15:41:55',	'0',	'/1060.ipa',	'r23',	'',	'',	2680,	0,	0,	'development',	'apple@mobgen.com',	'',	'http://-alt.mobgen.com',	1,	0,	0,	'com.mobgen.lifespotters',	'9autlphq0dk',	0,	NULL,	1,	1345556515,	1345556515),
(1061,	'Lifespotters 2012-08-21\'',	'lifespotters-2012-08-21',	'2012-08-21 15:50:10',	'2012-08-21 15:50:10',	'0',	'/1061.ipa',	'r24',	'',	'',	2680,	0,	0,	'development',	'apple@mobgen.com',	'',	'http://-alt.mobgen.com',	1,	0,	0,	'com.mobgen.lifespotters',	'5d77w01wqxvj',	0,	NULL,	1,	1345557010,	1345557010),
(1062,	'Lifespotters 2012-08-21\'\'\'\'',	'lifespotters-2012-08-21',	'2012-08-21 16:01:59',	'2012-08-21 16:01:59',	'0',	'/1062.ipa',	'r27',	'',	'',	2680,	0,	0,	'development',	'apple@mobgen.com',	'',	'http://-alt.mobgen.com',	1,	0,	0,	'com.mobgen.lifespottersenterprise',	'hk2aiypswn6e',	0,	NULL,	1,	1345557719,	1345557719),
(1063,	'OnsOranje iPad 27-8-2012',	'onsoranje-ipad-27-8-2012',	'2012-08-27 09:27:12',	'2012-08-27 09:27:12',	'0',	'/1063.ipa',	'r02',	'',	'',	1299,	0,	0,	'',	'tech@mobgen.com',	'',	'http://-alt.mobgen.com',	1,	0,	0,	'com.mobgen.onsoranjeHD',	'ay3f66j6io2k',	0,	NULL,	1,	1346052432,	1346052432),
(1064,	'OnsOranje iPad 27-8-2012 2',	'onsoranje-ipad-27-8-2012-2',	'2012-08-27 12:37:27',	'2012-08-27 12:39:32',	'0',	'/1064.ipa',	'r03',	'',	'',	1299,	0,	0,	'',	'apple@mobgen.com',	'',	'http://-alt.mobgen.com',	1,	0,	1,	'com.mobgen.onsoranjeHD',	'u0ur91xy21s',	0,	NULL,	1,	1346063847,	1346063972),
(1065,	'OnsOranje iPad 27-8-2012 3',	'onsoranje-ipad-27-8-2012-3',	'2012-08-27 12:42:52',	'2012-08-27 12:42:52',	'0',	'/1065.ipa',	'r04',	'',	'',	1299,	0,	0,	'',	'apple@mobgen.com',	'',	'http://-alt.mobgen.com',	1,	0,	1,	'com.mobgen.onsoranjeHD',	'fs7whwknl7o',	0,	NULL,	1,	1346064172,	1346064172),
(1066,	'OnsOranje 27-8-2012',	'onsoranje-27-8-2012',	'2012-08-27 12:47:39',	'2012-08-27 12:47:39',	'0',	'/1066.ipa',	'r02',	'',	'',	1298,	0,	0,	'',	'apple@mobgen.com',	'',	'http://-alt.mobgen.com',	1,	0,	1,	'com.mobgen.onsoranje',	'3waxqdstimgx',	0,	NULL,	1,	1346064459,	1346064459),
(1067,	'VL 2012-08-28 Beta-1.0 mobile.vipinvest.nl',	'vl-2012-08-28-beta-1-0-mobile-vipinvest-nl',	'2012-08-28 17:30:30',	'2012-08-28 17:30:30',	'0',	'/1067.ipa',	'',	'',	'',	2680,	0,	0,	'debug',	'',	'',	'http://-alt.mobgen.com',	1,	0,	0,	'com.mobgen.vanlanschot',	'2cbi7ybxdpg6',	0,	NULL,	1,	1346167830,	1346167830),
(1070,	'VL 2012-08-31',	'vl-2012-08-31',	'2012-08-31 16:40:29',	'2012-08-31 16:40:29',	'0',	'/1070.ipa',	'',	'',	'',	2680,	0,	0,	' release',	'',	'',	'http://-alt.mobgen.com',	1,	0,	0,	'com.mobgen.vanlanschot',	'h8z1jfoozt9',	0,	NULL,	1,	1346424029,	1346424029),
(1071,	'E-Control 3-09-2012',	'e-control-3-09-2012',	'2012-09-03 17:02:02',	'2012-09-03 17:02:02',	'0',	'/1071.ipa',	'r02',	'',	'',	1295,	0,	0,	'',	'apple@mobgen.com',	'',	'http://-alt.mobgen.com',	1,	0,	0,	'com.mobgen.meibes',	'qxbf6dvmnu7',	0,	NULL,	1,	1346684522,	1346684522),
(1072,	'VL 2012-09-04 Beta-1.4',	'vl-2012-09-04-beta-1-4',	'2012-09-04 09:59:56',	'2012-09-04 09:59:56',	'0',	'/1072.ipa',	'',	'',	'',	2680,	0,	0,	' release',	'',	'',	'http://-alt.mobgen.com',	1,	0,	0,	'com.mobgen.vanlanschot',	'1x6kgo955j5p',	0,	NULL,	1,	1346745596,	1346745596),
(1073,	'VL 2012-09-04 Beta-1.5',	'vl-2012-09-04-beta-1-5',	'2012-09-04 11:24:17',	'2012-09-04 11:24:17',	'0',	'/1073.ipa',	'',	'',	'Modified background expiration date to 5 secs',	2680,	0,	0,	' release',	'',	'',	'http://-alt.mobgen.com',	1,	0,	0,	'com.mobgen.vanlanschot',	'qruqa76ke',	0,	NULL,	1,	1346750657,	1346750657),
(1074,	'Who is who 6-09-2012',	'who-is-who-6-09-2012',	'2012-09-06 11:52:16',	'2012-09-06 11:52:16',	'0',	'/1074.ipa',	'r03',	'',	'',	1294,	0,	0,	'',	'apple@mobgen.com',	'',	'http://-alt.mobgen.com',	1,	0,	0,	'com.mobgen.whoiswhoenterprise',	'jcx8wfct6buy',	0,	NULL,	1,	1346925136,	1346925136),
(1075,	'Rhinetex v1c',	'rhinetex-v1c',	'2012-09-06 12:33:44',	'2012-09-06 12:33:44',	'0',	'/1075.ipa',	'3',	'',	'',	1806,	0,	0,	'',	'apple@mobgen.com',	'',	'http://-alt.mobgen.com',	1,	0,	1,	'*',	'wgyzwyg2ngzp',	0,	NULL,	1,	1346927624,	1346927624),
(1076,	'Who is who 6-09-2012 2',	'who-is-who-6-09-2012-2',	'2012-09-06 14:36:16',	'2012-09-06 14:36:16',	'0',	'/1076.ipa',	'r04',	'',	'',	1294,	0,	0,	'',	'apple@mobgen.com',	'',	'http://-alt.mobgen.com',	1,	0,	0,	'com.mobgen.whoiswhoenterprise',	'lh27xqtuiyg9',	0,	NULL,	1,	1346934976,	1346934976),
(1077,	'Who is who 6-09-2012 3',	'who-is-who-6-09-2012-3',	'2012-09-06 17:06:21',	'2012-09-07 15:35:09',	'0',	'/1077.ipa',	'r05',	'',	'',	1294,	0,	0,	'',	'apple@mobgen.com',	'',	'http://-alt.mobgen.com',	1,	0,	0,	'com.mobgen.whoiswhoenterprise',	'9pk65x6vd5oh',	0,	NULL,	1,	1346943981,	1347024909),
(1078,	'Piccolo 07.09 v2',	'piccolo-07-09-v2',	'2012-09-07 14:54:43',	'2012-09-07 14:56:45',	'0',	'/1078.ipa',	'',	'',	'',	1549,	0,	0,	'',	'',	'',	'http://-alt.mobgen.com',	1,	0,	1,	'com.piccolo.bookstore.world',	'63hq1gwzc7c',	0,	NULL,	1,	1347022483,	1347022605),
(1080,	'Piccolo 10.09',	'piccolo-10-09',	'2012-09-10 14:12:19',	'2012-09-10 14:14:57',	'0',	'/1080.ipa',	'',	'',	'',	1549,	0,	0,	'',	'',	'',	'http://-alt.mobgen.com',	1,	0,	1,	'com.piccolo.bookstore.world',	'ai3xecmr364',	0,	NULL,	1,	1347279139,	1347279297),
(1081,	'Rhinetex v7',	'rhinetex-v7',	'2012-09-11 22:32:27',	'2012-09-11 23:28:21',	'0',	'/1081.ipa',	'7',	'',	'',	1806,	0,	0,	'',	'apple@mobgen.com',	'',	'http://-alt.mobgen.com',	1,	0,	0,	'com.mobgen.mbs.rhinetex',	'xrs3wdiwv1md',	0,	NULL,	1,	1347395547,	1347398901),
(1082,	'Piccolo 11.09',	'piccolo-11-09',	'2012-09-12 09:58:15',	'2012-09-12 09:58:26',	'0',	'/1082.ipa',	'',	'',	'',	1549,	0,	0,	'',	'',	'',	'http://-alt.mobgen.com',	1,	0,	1,	'com.piccolo.bookstore.world',	'5j3pjcrlfco4',	0,	NULL,	1,	1347436695,	1347436706),
(1085,	'one more yeah!',	'one-more-yeah',	'2012-09-12 13:52:02',	'2012-09-12 13:52:32',	'0',	'/1085.ipa',	'1.2.3.6',	'',	'',	1805,	0,	0,	' release',	'tech@mobgen.com',	'',	'http://-alt.mobgen.com',	1,	0,	1,	'*',	'yrnn959ag8sq',	0,	NULL,	1,	1347450722,	1347450752),
(1087,	'ota insect',	'ota-insect',	'2012-09-12 14:40:40',	'2012-09-12 14:40:40',	'0',	'/1087.ipa',	'',	'',	'',	1805,	0,	0,	'debug',	'',	'',	'http://-alt.mobgen.com',	0,	0,	0,	'com.mobgen.NIBE',	'f0ewhwzpju8j',	0,	NULL,	1,	1347453640,	1347453640),
(1088,	'Mobgen Investor (ABN)',	'mobgen-investor-abn',	'2012-09-12 16:27:53',	'2012-09-12 16:27:53',	'0',	'/1088.ipa',	'',	'',	'',	2680,	0,	0,	'debug',	'',	'',	'http://-alt.mobgen.com',	1,	0,	0,	'com.mobgen.vlwhitelabel',	'7q8cnwt4a79i',	0,	NULL,	1,	1347460073,	1347460073),
(1089,	'Rhinetex v8',	'rhinetex-v8',	'2012-09-12 16:50:53',	'2012-09-12 16:50:53',	'0',	'/1089.ipa',	'8',	'',	'',	1806,	0,	0,	'',	'apple@mobgen.com',	'',	'http://-alt.mobgen.com',	1,	0,	0,	'com.mobgen.mbs.rhinetex',	'e6a6abjigi99',	0,	NULL,	1,	1347461453,	1347461453),
(1090,	'ABN Research Light 1.0',	'abn-research-light-1-0',	'2012-09-17 13:50:04',	'2012-09-18 13:34:08',	'0',	'/1090.ipa',	'1.0 beta',	'',	'',	1807,	0,	0,	'debug',	'',	'',	'http://-alt.mobgen.com',	1,	0,	0,	'com.mobgen.abn.privatebankinglight',	'yclhctl35r5v',	0,	NULL,	1,	1347882604,	1347968048),
(1091,	'Piccolo 17.09',	'piccolo-17-09',	'2012-09-17 17:37:41',	'2012-09-17 17:37:47',	'0',	'/1091.ipa',	'',	'',	'',	1549,	0,	0,	'',	'',	'',	'http://-alt.mobgen.com',	1,	0,	1,	'com.piccolo.bookstore.world',	'ilqfk5cuw0l3',	0,	NULL,	1,	1347896261,	1347896267),
(1092,	'Who is who 18-09-2012',	'who-is-who-18-09-2012',	'2012-09-18 14:35:44',	'2012-09-18 14:35:44',	'0',	'/1092.ipa',	'r06',	'',	'',	1294,	0,	0,	'',	'apple@mobgen.com',	'',	'http://-alt.mobgen.com',	1,	0,	0,	'com.mobgen.whoiswhoenterprise',	'vqyilu33k0o3',	0,	NULL,	1,	1347971744,	1347971744),
(1093,	'Audio beta 1',	'audio-beta-1',	'2012-09-20 15:02:39',	'2012-09-20 15:04:19',	'0',	'/1093.ipa',	'',	'',	'',	1809,	0,	0,	'debug',	'',	'',	'http://-alt.mobgen.com',	1,	0,	0,	'com.mobgen.abn.publicationapp',	'qzv6ferii5aq',	0,	NULL,	1,	1348146159,	1348146259),
(1094,	'VL 2012-09-20 Beta 1.8',	'vl-2012-09-20-beta-1-8',	'2012-09-20 17:16:49',	'2012-09-21 14:42:38',	'0',	'/1094.ipa',	'',	'',	'Fixed issue closing archive PDFs',	2680,	0,	0,	' release',	'',	'',	'http://-alt.mobgen.com',	1,	0,	0,	'com.mobgen.vanlanschot',	'9u2ro9mlr9rx',	0,	NULL,	1,	1348154209,	1348231358),
(1095,	'24 September Build',	'24-september-build',	'2012-09-24 11:03:39',	'2012-09-24 11:03:39',	'0',	'/1095.ipa',	'',	'',	'',	1810,	0,	0,	'debug',	'',	'',	'http://-alt.mobgen.com',	1,	0,	1,	'com.mobgen.redevco2Trial',	'ems5j7cjdv7o',	0,	NULL,	1,	1348477419,	1348477419),
(1096,	'Alpha Build',	'alpha-build',	'2012-09-24 11:48:42',	'2012-09-24 11:48:42',	'0',	'/1096.ipa',	'0.8',	'',	'',	1810,	0,	0,	'debug',	'',	'',	'http://-alt.mobgen.com',	1,	0,	1,	'com.mobgen.redevco2Trial',	'gu8pmpuspvhk',	0,	NULL,	1,	1348480122,	1348480122),
(1098,	'DNB origami test',	'dnb-origami-test',	'2012-09-27 15:27:26',	'2012-09-27 15:43:28',	'0',	'/1098.ipa',	'',	'',	'',	1805,	0,	0,	'debug',	'',	'',	'http://-alt.mobgen.com',	1,	0,	0,	'com.mobgen.vlwhitelabel',	'0go8ta1ds4p',	0,	NULL,	1,	1348752446,	1348753408),
(1099,	'ABN Research Light 1.5',	'abn-research-light-1-5',	'2012-09-27 17:52:06',	'2012-09-27 17:52:06',	'0',	'/1099.ipa',	'1.5 beta',	'',	'',	1807,	0,	0,	'debug',	'',	'',	'http://-alt.mobgen.com',	1,	0,	0,	'com.mobgen.abn.privatebankinglight',	'csbeqzydponp',	0,	NULL,	1,	1348761126,	1348761126),
(1101,	'ABN Research Light 1.6',	'abn-research-light-1-6',	'2012-09-28 12:45:13',	'2012-09-28 16:13:42',	'0',	'/1101.ipa',	'1.6 beta',	'',	'',	1807,	0,	0,	'debug',	'',	'',	'http://-alt.mobgen.com',	1,	0,	0,	'com.mobgen.abn.privatebankinglight',	'yjjwmrq23zme',	0,	NULL,	1,	1348829113,	1348841622),
(1102,	'VL beta 1.10',	'vl-beta-1-10',	'2012-10-01 17:34:29',	'2012-10-01 17:34:29',	'0',	'/1102.ipa',	'',	'',	'Change password modified for POST.\r\nAdded new error codes from Eelco',	2680,	0,	0,	'debug',	'',	'',	'http://-alt.mobgen.com',	1,	0,	0,	'com.mobgen.vanlanschot',	'r1wtn0evhbf',	0,	NULL,	1,	1349105669,	1349105669),
(1103,	'Audio beta 5',	'audio-beta-5',	'2012-10-02 10:08:29',	'2012-10-02 10:08:29',	'0',	'/1103.ipa',	'',	'',	'Increased version number to 1.2',	1809,	0,	0,	'debug',	'',	'',	'http://-alt.mobgen.com',	1,	0,	0,	'com.mobgen.abn.publicationapp',	'f5ask0kzby50',	0,	NULL,	1,	1349165309,	1349165309),
(1104,	'VL beta 1.11',	'vl-beta-1-11',	'2012-10-02 11:47:36',	'2012-10-02 14:00:58',	'0',	'/1104.ipa',	'',	'',	'Fixed typos.',	2680,	0,	0,	'debug',	'',	'',	'http://-alt.mobgen.com',	1,	0,	0,	'com.mobgen.vanlanschot',	'kmb0g6fwiq4e',	0,	NULL,	1,	1349171256,	1349179258),
(1105,	'Rhinetex v10',	'rhinetex-v10',	'2012-10-02 16:55:02',	'2012-10-02 16:55:02',	'0',	'/1105.ipa',	'10',	'',	'',	1806,	0,	0,	'',	'apple@mobgen.com',	'',	'http://-alt.mobgen.com',	1,	0,	0,	'com.mobgen.mbs.rhinetex',	'hvrwd2hwpoy5',	0,	NULL,	1,	1349189702,	1349189702),
(1106,	'2012-10-02',	'2012-10-02',	'2012-10-02 18:01:51',	'2012-10-04 16:27:40',	'3',	'/1106.ipa',	'1.0',	'',	'',	1810,	0,	0,	'debug',	'apple@mobgen.com',	'',	'http://-alt.mobgen.com',	1,	0,	0,	'com.mobgen.redevco.app',	'eq5x4i37rfeb',	0,	NULL,	1,	1349193711,	1349360860),
(1107,	'Aegon menu preview',	'aegon-menu-preview',	'2012-10-03 14:08:15',	'2012-10-03 14:08:15',	'0',	'/1107.ipa',	'',	'',	'',	1304,	0,	0,	'debug',	'',	'',	'http://-alt.mobgen.com',	1,	0,	0,	'com.mobgen.vlwhitelabel',	'6lhlefnlukrh',	0,	NULL,	1,	1349266095,	1349266095),
(1108,	'VL beta 1.12',	'vl-beta-1-12',	'2012-10-04 12:36:41',	'2012-10-04 12:36:48',	'0',	'/1108.ipa',	'',	'',	'Removed error code 413 for deauth messages. Used error code 400 instead',	2680,	0,	0,	'debug',	'',	'',	'http://-alt.mobgen.com',	1,	0,	0,	'com.mobgen.vanlanschot',	'es1eewdk1q0i',	0,	NULL,	1,	1349347001,	1349347008),
(1109,	'ShellIR',	'shellir',	'2012-10-04 15:41:06',	'2012-10-05 09:50:23',	'0',	'/1109.apk',	'1.5_180',	'',	'fix webcast webview on Samsung S3',	1292,	0,	0,	'Production',	'',	'',	'http://-alt.mobgen.com',	1,	1,	0,	'com.mobgen.shellir',	'mqlfehxwksne',	0,	NULL,	1,	1349358066,	1349423423),
(1110,	'2012-10-04',	'2012-10-04',	'2012-10-04 20:04:13',	'2012-10-04 20:45:02',	'3',	'/1110.ipa',	'1.0',	'',	'',	1810,	0,	0,	'debug',	'apple@mobgen.com',	'',	'http://.mobgen.com',	1,	0,	0,	'com.mobgen.redevco.app',	'ndkky2xbkd8',	0,	NULL,	1,	1349373853,	1349376302),
(1111,	'ABN RC 1',	'abn-rc-1',	'2012-10-05 14:54:10',	'2012-10-05 14:54:10',	'0',	'/1111.ipa',	'',	'',	'Modified \"Loading Audio\" text in audio screen',	1809,	0,	0,	'debug',	'',	'',	'http://-alt.mobgen.com',	1,	0,	0,	'com.mobgen.abn.publicationapp',	'1t6k4fj7ei3j',	0,	NULL,	1,	1349441650,	1349441650),
(1112,	'2012-10-05',	'2012-10-05',	'2012-10-05 15:58:39',	'2012-10-05 21:56:17',	'3',	'/1112.ipa',	'1.0',	'',	'',	1810,	0,	0,	'debug',	'apple@mobgen.com',	'',	'http://-alt.mobgen.com',	1,	0,	0,	'com.mobgen.redevco.app',	'05euq26l7gq',	0,	NULL,	1,	1349445519,	1349466977),
(1113,	'Shell IR 1.3 347',	'shell-ir-1-3-347',	'2012-10-05 17:19:46',	'2012-10-25 13:33:42',	'0',	'/1113.ipa',	'1.3 347',	'',	'',	1292,	0,	0,	'Production',	'apple@mobgen.com',	'',	'http://shell-dev.mobgen.com',	1,	0,	0,	'com.mobgen.shellinvestormedia',	'djqhs3tbx7ed',	0,	NULL,	1,	1349450386,	1351164822),
(1114,	'Shell IR 1.3 346',	'shell-ir-1-3-346',	'2012-10-05 18:13:35',	'2012-10-05 18:15:11',	'0',	'/1114.ipa',	'1.3 346',	'',	'',	1292,	0,	0,	'Alternative',	'apple@mobgen.com',	'',	'http://-alt.mobgen.com',	1,	0,	0,	'com.mobgen.shellinvestormedia',	'nw8txamyi03z',	0,	NULL,	1,	1349453615,	1349453711),
(1115,	'2012-10-06',	'2012-10-06',	'2012-10-05 22:43:49',	'2012-11-09 12:20:22',	'3',	'/1115.ipa',	'1.0',	'',	'',	1810,	0,	0,	'debug',	'apple@mobgen.com',	'',	'http://-alt.mobgen.com',	1,	0,	0,	'com.mobgen.redevco.app',	'e0auahrnji0k',	0,	NULL,	1,	1349469829,	1352460022),
(1116,	'KIA',	'kia',	'2012-10-08 11:34:52',	'2012-10-08 11:34:52',	'0',	'/1116.ipa',	'',	'',	'',	1305,	0,	0,	'debug',	'',	'',	'http://-alt.mobgen.com',	1,	0,	0,	'com.mobgen.kia-presenter',	'77n9uy8ylx3b',	0,	NULL,	1,	1349688892,	1349688892),
(1117,	'eControl 08-10-2012',	'econtrol-08-10-2012',	'2012-10-08 14:14:04',	'2012-10-08 18:13:48',	'0',	'/1117.ipa',	'1.1',	'',	'',	1295,	0,	0,	'',	'apple@mobgen.com',	'',	'http://-alt.mobgen.com',	1,	0,	0,	'com.mobgen.eControlForMEibes',	'7tajbt77p3lm',	0,	NULL,	1,	1349698444,	1349712828),
(1118,	'Rhinetex v12',	'rhinetex-v12',	'2012-10-08 18:29:43',	'2012-10-08 18:29:43',	'0',	'/1118.ipa',	'12',	'',	'Visual changes to pixel perfect align gui controls as much as possible.',	1806,	0,	0,	'',	'apple@mobgen.com',	'',	'http://-alt.mobgen.com',	1,	0,	0,	'com.mobgen.mbs.rhinetex',	'oa30gv8firq',	0,	NULL,	1,	1349713783,	1349713783),
(1119,	'VL beta 1.13',	'vl-beta-1-13',	'2012-10-09 15:22:14',	'2012-10-09 15:22:14',	'0',	'/1119.ipa',	'',	'',	'Increased size in chart fonts.\r\nModified some dutch translations',	2680,	0,	0,	'debug',	'',	'',	'http://-alt.mobgen.com',	1,	0,	0,	'com.mobgen.vanlanschot',	'afm442tli4uu',	0,	NULL,	1,	1349788934,	1349788934),
(1120,	'Shell IE Sascha Feed',	'shell-ie-sascha-feed',	'2012-10-10 10:12:54',	'2012-10-10 10:12:54',	'2',	'/1120.ipa',	'',	'',	'',	1035,	0,	0,	'Development',	'apple@mobgen.com',	'',	'http://shellinno-sascha.mobgenstage.com',	1,	0,	0,	'com.mobgen.shellinnovation',	'amt7llbu6gz7',	0,	NULL,	1,	1349856774,	1349856774),
(1121,	'VL beta 1.14',	'vl-beta-1-14',	'2012-10-11 16:43:07',	'2012-10-11 16:43:07',	'0',	'/1121.ipa',	'',	'',	'Modified response time when tapping a chart.',	2680,	0,	0,	'debug',	'',	'',	'http://-alt.mobgen.com',	1,	0,	0,	'com.mobgen.vanlanschot',	'zr0i6csmjq5',	0,	NULL,	1,	1349966587,	1349966587),
(1122,	'wijnshaker 12-10-12',	'wijnshaker-12-10-12',	'2012-10-12 15:53:34',	'2012-10-12 15:53:34',	'0',	'/1122.ipa',	'1.0',	'',	'',	1301,	0,	0,	'',	'apple@mobgen.com',	'',	'http://-alt.mobgen.com',	1,	0,	0,	'com.mobgen.wijnshaker2013',	'e613mwwwr8ga',	0,	NULL,	1,	1350050014,	1350050014),
(1123,	'VL beta 1.15',	'vl-beta-1-15',	'2012-10-12 17:17:02',	'2012-10-12 17:17:02',	'0',	'/1123.ipa',	'',	'',	'Bigger chart tooltip background image.',	2680,	0,	0,	'debug',	'',	'',	'http://-alt.mobgen.com',	1,	0,	0,	'com.mobgen.vanlanschot',	'avn1a3qjkm21',	0,	NULL,	1,	1350055022,	1350055022),
(1124,	'VL beta 1.16',	'vl-beta-1-16',	'2012-10-15 15:56:05',	'2012-10-15 15:56:05',	'0',	'/1124.ipa',	'',	'',	'Changed vermogensontwikkeling source data.\r\nChanged text labels in vermogensontwikkeling view.\r\nAdded dynamic size for chart tooltip.',	2680,	0,	0,	'debug',	'',	'',	'http://-alt.mobgen.com',	1,	0,	0,	'com.mobgen.vanlanschot',	'd19hmgxmqgy2',	0,	NULL,	1,	1350309365,	1350309365),
(1125,	'ABN Research Light 1.0 RC 2',	'abn-research-light-1-0-rc-2',	'2012-10-16 12:50:25',	'2012-10-16 15:41:26',	'0',	'/1125.ipa',	'1.0 RC 2',	'',	'',	1807,	0,	0,	'debug',	'',	'',	'http://-alt.mobgen.com',	1,	0,	0,	'com.mobgen.abn.privatebankinglight',	'gpqvw7mxov',	0,	NULL,	1,	1350384625,	1350394886),
(1126,	'Rhinetex v14',	'rhinetex-v14',	'2012-10-16 15:49:12',	'2012-10-16 15:49:12',	'0',	'/1126.ipa',	'14',	'',	'Implemented all feedback since last visit to Rhinetex.',	1806,	0,	0,	'',	'apple@mobgen.com',	'',	'http://-alt.mobgen.com',	1,	0,	0,	'com.mobgen.mbs.rhinetex',	'lgozhen3nv8',	0,	NULL,	1,	1350395352,	1350395352),
(1127,	'VL beta 1.17',	'vl-beta-1-17',	'2012-10-16 16:33:16',	'2012-10-16 16:33:16',	'0',	'/1127.ipa',	'',	'',	'Changed translated texts.\r\nAdded support to orientate the chart tooltip depending on the position.\r\n\r\n',	2680,	0,	0,	' release',	'',	'',	'http://-alt.mobgen.com',	1,	0,	0,	'com.mobgen.vanlanschot',	'0trhew1whsix',	0,	NULL,	1,	1350397996,	1350397996),
(1128,	'VL Test 1.17',	'vl-test-1-17',	'2012-10-16 17:10:50',	'2012-10-16 17:10:50',	'0',	'/1128.ipa',	'',	'',	'',	1805,	0,	0,	'debug',	'',	'',	'http://-alt.mobgen.com',	1,	0,	0,	'com.mobgen.vanlanschot',	'd7ub3aka15n',	0,	NULL,	1,	1350400250,	1350400250),
(1129,	'ABN Alt feed',	'abn-alt-feed',	'2012-10-17 10:25:27',	'2012-10-17 10:25:27',	'0',	'/1129.ipa',	'',	'',	'',	1809,	0,	0,	'debug',	'',	'',	'http://-alt.mobgen.com',	1,	0,	0,	'com.abnamro.insights',	'eig02zelsj29',	0,	NULL,	1,	1350462327,	1350462327),
(1130,	'VL beta 1.18',	'vl-beta-1-18',	'2012-10-17 17:50:08',	'2012-10-17 17:50:08',	'0',	'/1130.ipa',	'',	'',	'',	2680,	0,	0,	'debug',	'',	'',	'http://-alt.mobgen.com',	1,	0,	0,	'com.mobgen.vanlanschot',	'7l4j73zp9yb',	0,	NULL,	1,	1350489008,	1350489008),
(1131,	'Rhinetex v16',	'rhinetex-v16',	'2012-10-18 12:11:55',	'2012-10-18 12:11:55',	'0',	'/1131.ipa',	'16',	'',	'',	1806,	0,	0,	'',	'apple@mobgen.com',	'',	'http://-alt.mobgen.com',	1,	0,	0,	'com.mobgen.mbs.rhinetex',	'ftq61wzn2i95',	0,	NULL,	1,	1350555115,	1350555115),
(1132,	'Rhinetex v17',	'rhinetex-v17',	'2012-10-18 22:30:27',	'2012-10-18 22:30:27',	'0',	'/1132.ipa',	'v17',	'',	'',	1806,	0,	0,	'',	'',	'',	'http://-alt.mobgen.com',	1,	0,	0,	'com.mobgen.mbs.rhinetex',	'm6ql1j8iwfgn',	0,	NULL,	1,	1350592227,	1350592227),
(1133,	'Rhinetex v18',	'rhinetex-v18',	'2012-10-19 16:31:43',	'2012-10-19 16:31:43',	'0',	'/1133.ipa',	'v18',	'',	'',	1806,	0,	0,	'',	'apple@mobgen.com',	'',	'http://-alt.mobgen.com',	1,	0,	0,	'com.mobgen.mbs.rhinetex',	'4fagkzoanvmw',	0,	NULL,	1,	1350657103,	1350657103),
(1134,	'ABN Research Light 1.0 RC 4',	'abn-research-light-1-0-rc-4',	'2012-10-22 15:25:30',	'2012-10-22 16:07:47',	'0',	'/1134.ipa',	'1.0 RC 4',	'',	'',	1807,	0,	0,	'debug',	'',	'',	'http://-alt.mobgen.com',	1,	0,	0,	'com.mobgen.abn.privatebankinglight',	'ex674a6sw6ez',	0,	NULL,	1,	1350912330,	1350914867),
(1135,	'Rhinetex v19',	'rhinetex-v19',	'2012-10-22 16:09:34',	'2012-10-22 16:09:34',	'0',	'/1135.ipa',	'v19',	'',	'Added activity indicator',	1806,	0,	0,	'',	'apple@mobgen.com',	'',	'http://-alt.mobgen.com',	1,	0,	0,	'com.mobgen.mbs.rhinetex',	'qng8s8gaccrm',	0,	NULL,	1,	1350914974,	1350914974),
(1136,	'ABN ZZP',	'abn-zzp',	'2012-10-22 16:38:12',	'2012-12-14 11:26:47',	'0',	'/1136.ipa',	'1',	'',	'fe',	1307,	0,	0,	'',	'',	'',	'http://-alt.mobgen.com',	0,	0,	0,	'com.mobgen.abn.zzp',	'g6ow28los22q',	0,	NULL,	1,	1350916692,	1355480807),
(1137,	'ZZP 2',	'zzp-2',	'2012-10-22 16:47:47',	'2012-12-14 11:27:01',	'0',	'/1137.ipa',	'',	'',	'',	1307,	0,	0,	'',	'',	'',	'http://-alt.mobgen.com',	0,	0,	0,	'com.mobgen.abn.zzp',	'0r7wlvn4ebjd',	0,	NULL,	1,	1350917267,	1355480821),
(1138,	'Rhinetex v20',	'rhinetex-v20',	'2012-10-22 17:35:52',	'2012-10-22 17:35:52',	'0',	'/1138.ipa',	'v20',	'',	'Blue version',	1806,	0,	0,	'',	'apple@mobgen.com',	'',	'http://-alt.mobgen.com',	1,	0,	0,	'com.mobgen.mbs.rhinetex',	'gublcz5wk03o',	0,	NULL,	1,	1350920152,	1350920152),
(1139,	'KIA New Imagery',	'kia-new-imagery',	'2012-10-23 17:09:36',	'2012-10-23 17:09:36',	'0',	'/1139.ipa',	'',	'',	'',	1305,	0,	0,	'debug',	'',	'',	'http://-alt.mobgen.com',	1,	0,	0,	'com.mobgen.kia-presenter',	'n5u0n6ebztrz',	0,	NULL,	1,	1351004976,	1351004976),
(1140,	'Shell IR',	'shell-ir',	'2012-10-25 14:19:41',	'2012-10-25 17:48:12',	'0',	'/1140.ipa',	'1.3.1 349',	'',	'',	1292,	0,	0,	'Production',	'',	'',	'http://shell-dev-alt.mobgen.com',	1,	0,	0,	'com.mobgen.shellinvestormedia',	'9ukyzzsfqhh7',	0,	NULL,	1,	1351167581,	1351180092),
(1141,	'Rhinetex v21',	'rhinetex-v21',	'2012-10-25 22:23:00',	'2012-10-25 22:23:00',	'0',	'/1141.ipa',	'v21',	'',	'',	1806,	0,	0,	'',	'apple@mobgen.com',	'',	'http://-alt.mobgen.com',	1,	0,	0,	'com.mobgen.mbs.rhinetex',	'75rw9iflkd5z',	0,	NULL,	1,	1351196580,	1351196580),
(1142,	'KPMG_FRST_BULD',	'kpmg-frst-buld',	'2012-10-31 16:54:20',	'2012-11-07 19:13:28',	'0',	'/1142.ipa',	'0.003',	'',	'NAVIGATION, AND IMAGES',	1811,	0,	0,	'debug',	'',	'',	'http://-alt.mobgen.com',	1,	0,	1,	'*',	'nvc3b665n1n',	0,	NULL,	1,	1351698860,	1352312008),
(1143,	'VL Test Feed',	'vl-test-feed',	'2012-11-02 09:52:45',	'2012-11-02 09:52:45',	'0',	'/1143.ipa',	'',	'',	'',	2680,	0,	0,	'debug',	'',	'',	'http://-alt.mobgen.com',	1,	0,	0,	'com.mobgen.vanlanschot',	'm8f9s80blpyd',	0,	NULL,	1,	1351846365,	1351846365),
(1144,	'ABN ZZP Exporter',	'abn-zzp-exporter',	'2012-11-02 15:35:21',	'2013-05-20 18:18:35',	'0',	'/1144.ipa',	'0.1',	'',	'',	1307,	0,	0,	'',	'',	'',	'http://-alt.mobgen.com',	1,	0,	0,	'com.mobgen.abn.zzp',	'4seo0zxclu5',	0,	NULL,	1,	1351866921,	1369066715),
(1145,	'Overdue',	'overdue',	'2012-11-05 09:20:13',	'2012-11-05 09:20:13',	'0',	'/1145.ipa',	'v1',	'',	'',	1308,	0,	0,	'',	'apple@mobgen.com',	'',	'http://-alt.mobgen.com',	1,	0,	0,	'com.mobgen.pulse.overdue',	'p9cn5yqkoqjf',	0,	NULL,	1,	1352103613,	1352103613),
(1146,	'eControl performance demo',	'econtrol-performance-demo',	'2012-11-05 12:31:13',	'2012-11-05 12:31:13',	'0',	'/1146.ipa',	'',	'',	'',	1295,	0,	0,	'',	'',	'',	'http://-alt.mobgen.com',	1,	0,	0,	'com.mobgen.meibes',	'vatxi6eryx8i',	0,	NULL,	1,	1352115073,	1352115073),
(1147,	'Shell IR Stage test',	'shell-ir-stage-test',	'2012-11-05 17:14:11',	'2012-11-05 17:14:11',	'0',	'/1147.ipa',	'1.3.1 353',	'',	'',	1292,	0,	0,	'Staging',	'apple@mobgen.com',	'',	'http://shell-stage.mobgen.com',	1,	0,	0,	'com.mobgen.shellinvestormedia',	'17hmv4ipayvz',	0,	NULL,	1,	1352132051,	1352132051),
(1148,	'Rhinetex v24',	'rhinetex-v24',	'2012-11-06 17:58:53',	'2012-11-06 17:58:53',	'0',	'/1148.ipa',	'v24',	'',	'',	1806,	0,	0,	'',	'apple@mobgen.com',	'',	'http://-alt.mobgen.com',	1,	0,	0,	'com.mobgen.mbs.rhinetex',	'0nyr1joe1xcx',	0,	NULL,	1,	1352221133,	1352221133),
(1149,	'Final Production Build 2013',	'final-production-build-2013',	'2012-11-07 11:12:40',	'2012-11-20 11:24:58',	'1',	'/1149.ipa',	'',	'',	'',	1808,	0,	0,	'Production - final ',	'',	'',	'http://-alt.mobgen.com',	1,	0,	0,	'com.mobgen.abn.privatebanking',	'41x0iiyc2zh',	0,	NULL,	1,	1352283160,	1353407098),
(1150,	'Piccolo 02.10',	'piccolo-02-10',	'2012-11-08 17:06:44',	'2012-11-08 17:06:44',	'0',	'/1150.ipa',	'',	'',	'rotation iOS 6',	1549,	0,	0,	'',	'',	'',	'http://-alt.mobgen.com',	1,	0,	1,	'com.piccolo.bookstore.world',	'iimsurx4am4a',	0,	NULL,	1,	1352390804,	1352390804),
(1151,	'eControl 08-11-12',	'econtrol-08-11-12',	'2012-11-08 19:38:06',	'2012-11-08 19:38:06',	'0',	'/1151.ipa',	'',	'',	'',	1295,	0,	0,	'',	'',	'',	'http://-alt.mobgen.com',	1,	0,	0,	'com.mobgen.meibes',	'htdgqbkonfx',	0,	NULL,	1,	1352399886,	1352399886),
(1152,	'Shell IR',	'shell-ir',	'2012-11-08 19:56:16',	'2012-11-08 19:56:16',	'0',	'/1152.ipa',	'1.3.1 354',	'',	'',	1292,	0,	0,	'Alternative',	'',	'',	'http://shell-alt.mobgen.com',	1,	0,	0,	'com.mobgen.shellinvestormedia',	'849mfbsislx3',	0,	NULL,	1,	1352400976,	1352400976),
(1153,	'NIBE ',	'nibe',	'2012-11-09 17:14:33',	'2012-11-09 18:02:59',	'0',	'/1153.ipa',	'0.7',	'',	'',	1302,	0,	0,	'',	'',	'',	'http://-alt.mobgen.com',	1,	0,	0,	'com.mobgen.NIBE',	'en2ya1zj3752',	0,	NULL,	1,	1352477673,	1352480579),
(1154,	'Shell IR',	'shell-ir',	'2012-11-10 00:03:49',	'2012-11-10 00:03:49',	'0',	'/1154.ipa',	'1.3.1 356',	'',	'',	1292,	0,	0,	'Staging',	'',	'',	'http://-alt.mobgen.com',	1,	0,	0,	'com.mobgen.shellinvestormedia',	'72sr2ugl0zy8',	0,	NULL,	1,	1352502229,	1352502229),
(1155,	'Overdue',	'overdue',	'2012-11-12 11:07:36',	'2012-11-12 11:07:36',	'0',	'/1155.ipa',	'2',	'',	'',	1308,	0,	0,	'',	'apple@mobgen.com',	'',	'http://-alt.mobgen.com',	1,	0,	0,	'com.mobgen.pulse.overdue',	'rhdjubne6v8',	0,	NULL,	1,	1352714856,	1352714856),
(1156,	'Asset Viewer Checked',	'asset-viewer-checked',	'2012-11-14 11:11:30',	'2012-11-22 16:31:42',	'0',	'/1156.ipa',	'',	'',	'',	1812,	0,	0,	'',	'',	'',	'http://-alt.mobgen.com',	1,	0,	0,	'com.mobgen.Asset-Viewer-Enterprise',	'959qb1s1hzlg',	0,	NULL,	1,	1352887890,	1353598302),
(1157,	'KPMG Home',	'kpmg-home',	'2012-11-15 10:01:07',	'2012-11-15 10:01:07',	'0',	'/1157.ipa',	'0.2',	'',	'',	1811,	0,	0,	'debug',	'',	'',	'http://-alt.mobgen.com',	1,	0,	0,	'com.mobgen.kpmg',	'lqvnxhjko3bc',	0,	NULL,	1,	1352970067,	1352970067),
(1158,	'who is who build test ',	'who-is-who-build-test',	'2012-11-15 12:41:09',	'2012-11-15 12:41:09',	'0',	'/1158.ipa',	'',	'',	'',	1805,	0,	0,	'debug',	'',	'',	'http://-alt.mobgen.com',	1,	0,	0,	'com.mobgen.whoiswhoenterprise',	'sb1euflmcdz',	0,	NULL,	1,	1352979669,	1352979669),
(1159,	'Overdue b3',	'overdue-b3',	'2012-11-16 09:18:54',	'2012-11-16 09:18:54',	'0',	'/1159.ipa',	'b3',	'',	'',	1308,	0,	0,	'',	'apple@mobgen.com',	'',	'http://-alt.mobgen.com',	1,	0,	0,	'com.mobgen.pulse.overdue',	'ivicq57pjg2t',	0,	NULL,	1,	1353053934,	1353053934),
(1160,	'Who\'s who',	'who-s-who',	'2012-11-16 13:08:59',	'2012-11-16 13:12:27',	'0',	'/1160.ipa',	'1.0',	'',	'New provisioning profile',	1294,	0,	0,	' iOS',	'apple',	'',	'http://-alt.mobgen.com',	1,	0,	0,	'com.mobgen.whoiswhoenterprise',	'k6igvf9nl83j',	0,	NULL,	1,	1353067739,	1353067947),
(1161,	'DNB 1.0 alpha 3',	'dnb-1-0-alpha-3',	'2012-11-19 13:33:32',	'2012-11-19 13:33:32',	'0',	'/1161.ipa',	'1.0 alpha 3',	'',	'Added support to spin with 3D model in real time and bug fixes',	1309,	0,	0,	'alpha',	'apple',	'',	'http://-alt.mobgen.com',	1,	0,	0,	'com.mobgen.dnb',	'4xq8cirhatcu',	0,	NULL,	1,	1353328412,	1353328412),
(1162,	'Van Lanschot App store release ',	'van-lanschot-app-store-release',	'2012-11-20 09:01:25',	'2012-11-20 09:01:25',	'0',	'/1162.ipa',	'',	'',	'',	2680,	0,	0,	' release',	'apple',	'',	'http://-alt.mobgen.com',	1,	0,	0,	'com.mobgen.vanlanschot',	'rk49508qpbx1',	0,	NULL,	1,	1353398485,	1353398485),
(1163,	'DNB 1.0 alpha 4',	'dnb-1-0-alpha-4',	'2012-11-20 15:57:54',	'2012-11-20 15:57:54',	'0',	'/1163.ipa',	'1.0 alpha 4',	'',	'',	1309,	0,	0,	'alpha',	'apple',	'',	'http://-alt.mobgen.com',	1,	0,	0,	'com.mobgen.dnb',	'vtndf13fj8xh',	0,	NULL,	1,	1353423474,	1353423474),
(1164,	'ABN ZZP',	'abn-zzp',	'2012-11-21 10:50:55',	'2012-12-14 11:27:14',	'0',	'/1164.ipa',	'0.1',	'',	'iphone mode for ipad',	1307,	0,	0,	'',	'tech@mobgen.com',	'',	'http://-alt.mobgen.com',	0,	0,	0,	'com.mobgen.abn.zzp',	'nt4mt9d78q2',	0,	NULL,	1,	1353491455,	1355480834),
(1165,	'Overdue b4',	'overdue-b4',	'2012-11-21 11:31:34',	'2012-11-21 11:31:34',	'0',	'/1165.ipa',	'b4',	'',	'Added refresh and logout (in settings) buttons',	1308,	0,	0,	'',	'apple@mobgen.com',	'',	'http://-alt.mobgen.com',	1,	0,	0,	'com.mobgen.pulse.overdue',	'tilq1iich5yr',	0,	NULL,	1,	1353493894,	1353493894),
(1166,	'VL RC 1.0.1',	'vl-rc-1-0-1',	'2012-11-21 14:06:29',	'2012-11-21 14:06:29',	'0',	'/1166.ipa',	'',	'',	'',	2680,	0,	0,	'debug',	'',	'',	'http://-alt.mobgen.com',	1,	0,	0,	'com.mobgen.vanlanschot',	'c8sdsc2qyl5w',	0,	NULL,	1,	1353503189,	1353503189),
(1167,	'ABN ZZP',	'abn-zzp',	'2012-11-21 16:46:46',	'2012-12-14 11:27:20',	'0',	'/1167.ipa',	'0.11',	'',	'',	1307,	0,	0,	'',	'tech@mobgen.com',	'',	'http://-alt.mobgen.com',	0,	0,	0,	'com.mobgen.abn.zzp',	'i82ws96nbbh0',	0,	NULL,	1,	1353512806,	1355480840),
(1168,	'DNB 1.0 beta 2',	'dnb-1-0-beta-2',	'2012-11-21 17:03:05',	'2012-11-21 17:03:05',	'0',	'/1168.ipa',	'1.0 beta 2',	'',	'Added all videos to introduction contents',	1309,	0,	0,	' beta',	'apple',	'',	'http://-alt.mobgen.com',	1,	0,	0,	'com.mobgen.dnb',	'nmdj48t789r',	0,	NULL,	1,	1353513785,	1353513785),
(1169,	'ABN ZZP',	'abn-zzp',	'2012-11-21 18:12:58',	'2013-05-20 18:19:48',	'0',	'/1169.apk',	'0.11',	'',	'added timer functionality',	1307,	0,	0,	'',	'',	'',	'http://-alt.mobgen.com',	1,	1,	0,	'com.mobgen.abn.zzp',	'adeevzvth981',	0,	NULL,	1,	1353517978,	1369066788),
(1170,	'NIBE',	'nibe',	'2012-11-22 17:50:47',	'2012-11-22 17:50:47',	'0',	'/1170.ipa',	'0.7.2',	'',	'',	1302,	0,	0,	'',	'',	'',	'http://-alt.mobgen.com',	1,	0,	0,	'com.mobgen.NIBE',	'zlrhccpo0zm5',	0,	NULL,	1,	1353603047,	1353603047),
(1171,	'DNB 1.0 beta 3',	'dnb-1-0-beta-3',	'2012-11-23 15:15:07',	'2012-11-23 17:59:50',	'0',	'/1171.ipa',	'1.0 beta 3',	'',	'MAny Bug fixed and improved general stability.',	1309,	0,	0,	' beta',	'apple',	'',	'http://-alt.mobgen.com',	1,	0,	0,	'com.mobgen.dnb',	'kgya0ucst5v',	0,	NULL,	1,	1353680107,	1353689990),
(1172,	'KPMG External',	'kpmg-external',	'2012-11-23 17:18:26',	'2012-11-23 17:18:26',	'0',	'/1172.ipa',	'0.3',	'',	'',	1811,	0,	0,	'debug',	'',	'',	'http://-alt.mobgen.com',	1,	0,	0,	'com.mobgen.kpmg',	'a2pzpcmwz41',	0,	NULL,	1,	1353687506,	1353687506),
(1173,	'ABN ZZP',	'abn-zzp',	'2012-11-25 17:57:18',	'2012-12-14 11:27:40',	'0',	'/1173.ipa',	'0.12',	'',	'- various design fixes\r\n- dynamic notifications\r\n- dynamically generated csv files\r\n- google maps integration (Android only)',	1307,	0,	0,	'',	'tech@mobgen.com',	'',	'http://-alt.mobgen.com',	0,	0,	0,	'com.mobgen.abn.zzp',	'hvwty85pnmxu',	0,	NULL,	1,	1353862638,	1355480860),
(1174,	'Piccolo 27.11',	'piccolo-27-11',	'2012-11-27 17:19:12',	'2012-11-27 17:19:12',	'0',	'/1174.ipa',	'',	'',	'',	1549,	0,	0,	'',	'',	'',	'http://-alt.mobgen.com',	1,	0,	1,	'com.piccolo.bookstore.world',	'hqvt60mfkhv7',	0,	NULL,	1,	1354033152,	1354033152),
(1175,	'ABN ZZP',	'abn-zzp',	'2012-11-27 17:46:43',	'2012-12-14 11:27:58',	'0',	'/1175.ipa',	'0.15',	'',	'Timer fixed.\r\nShow correct data of time on dashboard/overview\r\nAlert box changed to Phonegap style (no more index.html)\r\nfixed projectItem overview\r\nalignment issues\r\nGps restarts and continues after closure from app\r\ninvoice forms\r\nproject client fixed\r\nclients fixed!\r\nand various other issues',	1307,	0,	0,	'',	'tech@mobgen.com',	'',	'http://-alt.mobgen.com',	0,	0,	0,	'com.mobgen.abn.zzp',	'm2ak4v0pkyy6',	0,	NULL,	1,	1354034803,	1355480878),
(1176,	'Who is who',	'who-is-who',	'2012-11-28 09:40:03',	'2013-01-04 17:05:27',	'0',	'/1176.ipa',	'1.1',	'',	'Various bug fixes. Apphance support added.',	1294,	0,	0,	' iOS',	'',	'',	'http://-alt.mobgen.com',	1,	0,	0,	'com.mobgen.whoiswhoenterprise',	'0ygnuabjx0s',	0,	NULL,	1,	1354092003,	1357315527),
(1177,	'Shell IE push  ',	'shell-ie-push',	'2012-11-28 18:22:24',	'2012-11-28 18:22:24',	'0',	'/1177.ipa',	'1.3.24 800',	'',	'Deleting an article should now remove it also when refreshing',	1035,	0,	0,	'Development',	'',	'',	'http://mobgen-dev.mobgen.com',	1,	0,	0,	'com.mobgen.shellinnovation',	'e7o6d6fpzn',	0,	NULL,	1,	1354123344,	1354123344),
(1178,	'ABN ZZP',	'abn-zzp',	'2012-11-28 21:41:49',	'2012-12-14 11:28:12',	'0',	'/1178.ipa',	'0.16',	'',	'- various date/calendar fixes\r\n- more invoice functionality\r\n- GPS for iOS added\r\n- GPS for Android optimized\r\n- Notifications back button\r\n- Client update fix',	1307,	0,	0,	'',	'tech@mobgen.com',	'',	'http://-alt.mobgen.com',	0,	0,	0,	'com.mobgen.abn.zzp',	'hivx6u61csi5',	0,	NULL,	1,	1354135309,	1355480892),
(1179,	'Shell IE',	'shell-ie',	'2012-11-30 14:13:59',	'2012-11-30 14:13:59',	'0',	'/1179.ipa',	'1.4 801',	'',	'',	1035,	0,	0,	'Alternative',	'',	'',	'http://shellinno-alt.mobgen.com',	1,	0,	0,	'com.mobgen.shellinnovation',	'4id9nf3ixx8o',	0,	NULL,	1,	1354281239,	1354281239),
(1180,	'DNB 1.0 beta 5',	'dnb-1-0-beta-5',	'2012-11-30 16:12:15',	'2012-12-03 09:47:28',	'0',	'/1180.ipa',	'1.0 beta 5',	'',	'',	1309,	0,	0,	' beta',	'apple',	'',	'http://-alt.mobgen.com',	1,	0,	0,	'com.mobgen.dnb',	'05ndvzfnfc1',	0,	NULL,	1,	1354288335,	1354524448),
(1182,	'ABN ZZP',	'abn-zzp',	'2012-11-30 18:39:12',	'2012-12-14 11:28:40',	'0',	'/1182.apk',	'0.18',	'',	'- Possibility added to generate invoices\r\n- generated .csv files can be shared (iOS only)\r\n- fixed an issue where sometimes the app got stuck on splash screen.\r\n- extra validation added in forms',	1307,	0,	0,	'',	'tech@mobgen.com',	'',	'http://-alt.mobgen.com',	0,	1,	0,	'com.mobgen.zzp',	'dl8760d1sukj',	0,	NULL,	1,	1354297152,	1355480920),
(1183,	'eControl - NL 03-12-12',	'econtrol-nl-03-12-12',	'2012-12-03 12:15:13',	'2012-12-03 12:15:13',	'0',	'/1183.ipa',	'1.2',	'',	'',	1295,	0,	0,	'',	'',	'',	'http://-alt.mobgen.com',	1,	0,	0,	'com.mobgen.meibes.nl',	'3ee3d53gblmn',	0,	NULL,	1,	1354533313,	1354533313),
(1184,	'ABN ZZP Android 0.19',	'abn-zzp-android-0-19',	'2012-12-03 17:47:32',	'2012-12-14 11:28:52',	'0',	'/1184.apk',	'0.19',	'',	'',	1307,	0,	0,	'',	'',	'',	'http://-alt.mobgen.com',	0,	1,	0,	'com.mobgen.zzp',	'7db4sih0h232',	0,	NULL,	1,	1354553252,	1355480932),
(1185,	'DNB 1.0 RC 2',	'dnb-1-0-rc-2',	'2012-12-04 14:09:14',	'2012-12-04 15:09:07',	'0',	'/1185.ipa',	'1.0 RC 2',	'',	'',	1309,	0,	0,	' candidate',	'apple',	'',	'http://-alt.mobgen.com',	1,	0,	0,	'com.mobgen.dnb',	'iwt3cqh1y7zc',	0,	NULL,	1,	1354626554,	1354630147),
(1186,	'ABN ZZP',	'abn-zzp',	'2012-12-04 18:02:58',	'2012-12-14 11:29:12',	'0',	'/1186.apk',	'0.20',	'',	'Attention: You might need to reinstall the app for the changes to work\r\n\r\n- Xperia floating input issue resolved\r\n- You can now add a client while adding a project while adding any registration\r\n- scrolling is now possible for iOS 4.3\r\n- date and calendar should be working on all devices\r\n- iOS GPS tracking will now also work in locked mode\r\n- Android exporting should now actually export the generated file\r\n- editing time while running timer fixed',	1307,	0,	0,	'',	'',	'',	'http://-alt.mobgen.com',	0,	1,	0,	'com.mobgen.abnzzp',	'6wa1avg1l49d',	0,	NULL,	1,	1354640578,	1355480952),
(1188,	'OnsOranje iPad 05-12-12 5',	'onsoranje-ipad-05-12-12-5',	'2012-12-05 11:15:09',	'2012-12-13 17:29:59',	'0',	'/1188.ipa',	'r06',	'',	'Added team names to agenda page',	1299,	0,	0,	'',	'',	'',	'http://-alt.mobgen.com',	1,	0,	0,	'com.mobgen.onsoranjeHD.adhoc',	'la6g1vinpgu',	0,	NULL,	1,	1354702509,	1355416199),
(1190,	'NIBE',	'nibe',	'2012-12-05 18:57:12',	'2012-12-05 18:57:12',	'0',	'/1190.ipa',	'0.8',	'',	'',	1302,	0,	0,	'',	'',	'',	'http://-alt.mobgen.com',	1,	0,	0,	'com.mobgen.NIBE',	'xjh2h2gxcmc5',	0,	NULL,	1,	1354730232,	1354730232),
(1191,	'ABN ZZP',	'abn-zzp',	'2012-12-05 19:52:44',	'2012-12-14 11:29:18',	'0',	'/1191.ipa',	'0.21',	'',	'You might need to reinstall the app for all functionality to work\r\n\r\n- The app will go to terms and wizard first on fresh install\r\n- various timer bugs fixed\r\n- Android can open links in the browser instead of in the app\r\n- fix for click to call in iOS\r\n- twitter sharing from aanbevelen\r\n- country added to client\r\n- S1 fixes and language selection and timeline removed\r\n- New pop-up on changing KM while tracking gps\r\n- Route button disabled on tracking gps\r\n- various lay-out issues solved',	1307,	0,	0,	'',	'',	'',	'http://-alt.mobgen.com',	0,	0,	0,	'com.mobgen.abn.zzp',	'hcddx68h',	0,	NULL,	1,	1354733564,	1355480958),
(1192,	'ABN ZZP',	'abn-zzp',	'2012-12-06 20:49:18',	'2012-12-14 11:29:35',	'0',	'/1192.apk',	'0.22',	'',	'- Sitecatalyst tracking added\r\n- readable date notifications fixed\r\n- timer now works after screen is locked\r\n- back button in Android will actually go back\r\n- Xperia form madness...\r\n- user and winter/summertime date fix\r\n- Export is actually working (Android)\r\n- GPS optimized (Points close together get skipped)\r\n- App aanbevelen is now working\r\n- Fixed prompts',	1307,	0,	0,	'',	'',	'',	'http://-alt.mobgen.com',	0,	1,	0,	'com.mobgen.zzp',	'erfqclri1rz',	0,	NULL,	1,	1354823358,	1355480975),
(1193,	'eControl NL 07-12-12',	'econtrol-nl-07-12-12',	'2012-12-07 13:16:50',	'2013-01-09 12:47:25',	'0',	'/1193.ipa',	'',	'',	'Speed improvements and info changes',	1295,	0,	0,	'',	'',	'',	'http://-alt.mobgen.com',	1,	0,	0,	'com.mobgen.meibes.nl',	'57ejvuyxcmnd',	0,	NULL,	1,	1354882610,	1357732045),
(1194,	'ABN ZZP',	'abn-zzp',	'2012-12-07 16:00:41',	'2012-12-14 11:29:48',	'0',	'/1194.ipa',	'0.22.5',	'',	'Reinstall might be needed for the app to work properly.\r\nBe aware that this is a middle-of-the-day development version, which could contain untested feautures or debug information\r\n\r\n- bugfix share pagina for iphone to make linkedin twitter and facebook working!\r\n- instellingen -> tarieven works again\r\n- contact -> website works again\r\n- after accepting terms, never show accept button again\r\n- welcome message fixed.\r\n- iOS GPS should start again\r\n- Several GPS bugfixes',	1307,	0,	0,	'',	'',	'',	'http://-alt.mobgen.com',	0,	0,	0,	'com.mobgen.abn.zzp',	'2ldrxc82mx',	0,	NULL,	1,	1354892441,	1355480988),
(1195,	'ABN Research Test -alt',	'abn-research-test-alt',	'2012-12-10 10:25:19',	'2013-02-25 11:40:31',	'0',	'/1195.ipa',	'1.4',	'',	'',	1807,	0,	0,	'debug',	'',	'',	'http://-alt.mobgen.com',	1,	0,	0,	'com.mobgen.abn.privatebanking',	'6zezkr8m8kr0',	0,	NULL,	1,	1355131519,	1361788831),
(1196,	'Rhinetex v27',	'rhinetex-v27',	'2012-12-10 17:07:25',	'2012-12-10 17:07:25',	'0',	'/1196.ipa',	'v27',	'',	'Fixed Notions selections',	1806,	0,	0,	'',	'apple@mobgen.com',	'',	'http://-alt.mobgen.com',	1,	0,	0,	'com.mobgen.mbs.rhinetex',	'jxnb5zwihzw',	0,	NULL,	1,	1355155645,	1355155645),
(1197,	'ABN ZZP',	'abn-zzp',	'2012-12-10 18:50:19',	'2012-12-14 11:30:22',	'0',	'/1197.apk',	'0.24',	'',	'Dashboard button fixes\r\nSocial Media Text Changes and bug fixes\r\nAccept terms fix\r\nAlternative Export feature\r\n',	1307,	0,	0,	'',	'',	'',	'http://-alt.mobgen.com',	0,	1,	0,	'com.mobgen.zzp',	'kvhbhj3ggkfr',	0,	NULL,	1,	1355161819,	1355481022),
(1198,	'Shell IE POC',	'shell-ie-poc',	'2012-12-10 21:38:05',	'2012-12-11 10:58:33',	'0',	'/1198.ipa',	'POC',	'',	'',	1035,	0,	0,	'Production',	'',	'',	'no feed',	1,	0,	0,	'com.mobgen.shellinnovation',	'ffq41et5756p',	0,	NULL,	1,	1355171885,	1355219913),
(1199,	'Executive App',	'executive-app',	'2012-12-11 17:13:21',	'2012-12-11 17:13:21',	'0',	'/1199.ipa',	'0.8.1',	'',	'',	1302,	0,	0,	'',	'',	'',	'http://-alt.mobgen.com',	1,	0,	0,	'com.mobgen.NIBE',	'c6ax2k1odfmy',	0,	NULL,	1,	1355242401,	1355242401),
(1201,	'ABN ZZP',	'abn-zzp',	'2012-12-12 15:41:26',	'2012-12-14 11:30:53',	'0',	'/1201.ipa',	'0.25.5',	'',	'Please note this is a middle-of-the-day release, which means it\'s not 100% tested. Possible bugs will be fixed in tonights release\r\n\r\n- omniture changes (asynchronous loading)\r\n- small GPS fixes\r\n- htc and expedia form issues\r\n- only save nl notifications\r\n- links in notifications open in browser only\r\n- hourSelect can not return NaN\r\n- The user should see a pop-up message when he has modified information and goes back to tell him moderations will not be saved.\r\n- fix in phone numbers\r\n',	1307,	0,	0,	'',	'',	'',	'http://-alt.mobgen.com',	0,	0,	0,	'com.mobgen.abn.zzp',	'tfp958179p04',	0,	NULL,	1,	1355323286,	1355481053),
(1202,	'ABN ZZP',	'abn-zzp',	'2012-12-12 15:43:59',	'2012-12-14 11:30:59',	'0',	'/1202.apk',	'0.25.5',	'',	'Please note this is a middle-of-the-day release, which means it\'s not 100% tested. Possible bugs will be fixed in tonights release\r\n\r\n- omniture changes (asynchronous loading)\r\n- small GPS fixes\r\n- htc and expedia form issues\r\n- only save nl notifications\r\n- links in notifications open in browser only\r\n- hourSelect can not return NaN\r\n- The user should see a pop-up message when he has modified information and goes back to tell him moderations will not be saved.\r\n- fix in phone numbers\r\n',	1307,	0,	0,	'',	'',	'',	'http://-alt.mobgen.com',	0,	1,	0,	'com.mobgen.zzp',	'gnk5s33cnqxc',	0,	NULL,	1,	1355323439,	1355481059),
(1203,	'ABN ZZP',	'abn-zzp',	'2012-12-12 19:21:45',	'2012-12-14 11:31:07',	'0',	'/1203.ipa',	'0.25.6',	'',	'',	1307,	0,	0,	'',	'',	'',	'http://-alt.mobgen.com',	0,	0,	0,	'com.mobgen.abn.zzp',	'0krbij94u5yo',	0,	NULL,	1,	1355336505,	1355481067),
(1204,	'Shell IE',	'shell-ie',	'2012-12-13 12:30:40',	'2012-12-13 17:39:32',	'0',	'/1204.ipa',	'1.4.804',	'',	'Fixed pull to refresh when you don\'t have network connectivity.\r\nUses GA prod',	1035,	0,	0,	'Production',	'',	'',	'http://shellinno.mobgen.com',	1,	0,	0,	'com.mobgen.shellinnovation',	't82s3tnt39tv',	0,	NULL,	1,	1355398240,	1355416772),
(1205,	'ABN ZZP',	'abn-zzp',	'2012-12-13 13:30:20',	'2012-12-21 12:12:50',	'0',	'/1205.ipa',	'1.01',	'',	'- Splash screen will no longer jump up and down (iOS)',	1307,	0,	0,	'',	'',	'',	'http://-alt.mobgen.com',	0,	0,	0,	'com.mobgen.abn.zzp',	'kd6o9a8cc3av',	0,	NULL,	1,	1355401820,	1356088370),
(1206,	'Shell IE',	'shell-ie',	'2012-12-13 17:41:20',	'2012-12-13 18:27:08',	'0',	'/1206.ipa',	'1.4 803',	'',	'',	1035,	0,	0,	'Alternative',	'',	'',	'http://shellinno-alt.mobgen.com',	1,	0,	0,	'com.mobgen.shellinnovation',	'h8kgxrc4vo7',	0,	NULL,	1,	1355416880,	1355419628),
(1207,	'ABN ZZP',	'abn-zzp',	'2012-12-14 11:21:00',	'2012-12-21 12:13:00',	'0',	'/1207.apk',	'1.02',	'',	'Replaced factuurnummer with the date in the csv filename.',	1307,	0,	0,	'',	'',	'',	'http://-alt.mobgen.com',	0,	1,	0,	'com.mobgen.zzp',	'qujhzei6jbh',	0,	NULL,	1,	1355480460,	1356088380),
(1209,	'Shell IE',	'shell-ie',	'2012-12-17 10:15:36',	'2012-12-17 10:26:53',	'0',	'/1209.ipa',	'1.4 805',	'',	'',	1035,	0,	0,	'Production',	'',	'',	'http://shellinni.mobgen.com',	1,	0,	0,	'com.mobgen.shellinnovation',	'rm0l640n55ud',	0,	NULL,	1,	1355735736,	1355736413),
(1210,	'VL Transactions rev 928',	'vl-transactions-rev-928',	'2012-12-18 13:14:41',	'2012-12-18 13:16:49',	'0',	'/1210.ipa',	'',	'',	'',	2680,	0,	0,	'debug',	'',	'',	'http://-alt.mobgen.com',	1,	0,	0,	'com.mobgen.vanlanschot',	'c1q2as7bgu',	0,	NULL,	1,	1355832881,	1355833009),
(1211,	'KPMG 0.9',	'kpmg-0-9',	'2012-12-18 19:55:31',	'2012-12-18 20:20:39',	'0',	'/1211.ipa',	'0.9',	'',	'',	1811,	0,	0,	'debug',	'',	'',	'http://-alt.mobgen.com',	1,	0,	0,	'com.mobgen.kpmg',	'oi6sw48swme',	0,	NULL,	1,	1355856931,	1355858439),
(1212,	'The Executive App',	'the-executive-app',	'2012-12-18 23:06:34',	'2012-12-18 23:40:30',	'0',	'/1212.ipa',	'0.8.2',	'',	'',	1302,	0,	0,	'',	'',	'',	'http://-alt.mobgen.com',	1,	0,	0,	'com.mobgen.NIBE',	'dteztx1t70q',	0,	NULL,	1,	1355868394,	1355870430),
(1213,	'KPMG 1',	'kpmg-1',	'2012-12-20 12:35:07',	'2013-02-27 10:22:11',	'0',	'/1213.ipa',	'1.0',	'',	'',	1811,	0,	0,	' release',	'',	'',	'http://-alt.mobgen.com',	1,	0,	0,	'com.mobgen.kpmg',	'7frxnzlhinjl',	0,	NULL,	1,	1356003307,	1361956931),
(1214,	'eControl 20-12-2012',	'econtrol-20-12-2012',	'2012-12-20 14:34:57',	'2013-01-14 11:15:12',	'0',	'/1214.ipa',	'',	'',	'New buidlings',	1295,	0,	0,	'',	'',	'',	'http://-alt.mobgen.com',	1,	0,	0,	'com.mobgen.meibes',	'sp7dhpx7oau',	0,	NULL,	1,	1356010497,	1358158512),
(1216,	'eControl - UK 20-12-2012',	'econtrol-uk-20-12-2012',	'2012-12-20 18:15:32',	'2013-01-08 14:58:31',	'0',	'/1216.ipa',	'1.3',	'',	'Speed improvements',	1295,	0,	0,	'',	'',	'',	'http://-alt.mobgen.com',	1,	0,	0,	'com.mobgen.meibes.uk',	'pvnt2htxvvkc',	0,	NULL,	1,	1356023732,	1357653511),
(1217,	'OnsOranje iPhone 21-12-12',	'onsoranje-iphone-21-12-12',	'2012-12-21 17:00:08',	'2013-01-08 14:28:44',	'0',	'/1217.ipa',	'',	'',	'iPhone 5 support added, game winner asterix added',	1298,	0,	0,	'',	'',	'',	'http://-alt.mobgen.com',	1,	0,	0,	'com.mobgen.onsoranje.adhoc',	'fgajuq8l6fx',	0,	NULL,	1,	1356105608,	1357651724),
(1218,	'ABN ZZP',	'abn-zzp',	'2012-12-24 14:21:38',	'2012-12-24 14:56:01',	'0',	'/1218.ipa',	'1.04',	'',	'GPS fix\r\nIcon fix\r\nSplash fix',	1307,	0,	0,	'',	'',	'',	'http://-alt.mobgen.com',	1,	0,	0,	'com.mobgen.abn.zzp',	'fmqyhdnmn5',	0,	NULL,	1,	1356355298,	1356357361),
(1220,	'Piccolo 18.12',	'piccolo-18-12',	'2013-01-03 12:03:57',	'2013-01-03 12:03:57',	'0',	'/1220.ipa',	'18.12',	'',	'',	1549,	0,	0,	'',	'',	'',	'http://-alt.mobgen.com',	1,	0,	1,	'com.piccolo.bookstore.world',	't8kz2t47dlq8',	0,	NULL,	1,	1357211037,	1357211037),
(1221,	'ABN ZZP',	'abn-zzp',	'2013-01-07 17:17:31',	'2013-01-08 09:33:53',	'0',	'/1221.ipa',	'1.05',	'',	'Omniture will be loaded via ssl\r\ninbox messages will be loaded via ssl\r\nit\'s now possible to open https pages via the inbox\r\nremoved unused plugins\r\n',	1307,	0,	0,	'',	'',	'',	'http://-alt.mobgen.com',	1,	0,	0,	'com.mobgen.abn.zzp',	'v8ohlg7fvy',	0,	NULL,	1,	1357575451,	1357634033),
(1223,	'ABN ZZP',	'abn-zzp',	'2013-01-08 12:03:17',	'2013-01-08 12:03:17',	'0',	'/1223.ipa',	'1.06',	'',	'',	1307,	0,	0,	'',	'',	'',	'http://-alt.mobgen.com',	1,	0,	0,	'com.mobgen.abn.zzp',	'ijz68hbk98ny',	0,	NULL,	1,	1357642997,	1357642997),
(1224,	'ABN ZZP',	'abn-zzp',	'2013-01-09 09:52:09',	'2013-01-09 09:52:09',	'0',	'/1224.ipa',	'1.08',	'',	'expenses with 0 value will no longer show NaN in the invoices',	1307,	0,	0,	'',	'',	'',	'http://-alt.mobgen.com',	1,	0,	0,	'com.mobgen.abn.zzp',	'oz7b0ajfn1p9',	0,	NULL,	1,	1357721529,	1357721529),
(1225,	'Shell Inside Energy',	'shell-inside-energy',	'2013-01-09 18:00:51',	'2013-01-09 18:00:51',	'0',	'/1225.ipa',	'1.4 Internal Review',	'',	'',	1035,	0,	0,	'Production',	'',	'',	'http://shellinno.mobgen.com',	1,	0,	0,	'com.mobgen.shellinnovation',	'9awhdexdmx3',	0,	NULL,	1,	1357750851,	1357750851),
(1226,	'VimpleCom IR iOS',	'vimplecom-ir-ios',	'2013-01-11 13:58:44',	'2013-01-11 13:58:44',	'0',	'/1226.ipa',	'11.01',	'',	'',	1813,	0,	0,	'',	'',	'',	'http://-alt.mobgen.com',	1,	0,	0,	'com.mobgen.VimpelComIR',	'lzgc6xiesida',	0,	NULL,	1,	1357909124,	1357909124),
(1227,	'VL 2.0.0.9',	'vl-2-0-0-9',	'2013-01-14 14:15:39',	'2013-01-14 14:16:54',	'0',	'/1227.ipa',	'',	'',	'',	2680,	0,	0,	'debug',	'',	'',	'http://-alt.mobgen.com',	1,	0,	0,	'com.mobgen.vanlanschot',	'54gvyg6ysdaz',	0,	NULL,	1,	1358169339,	1358169414),
(1228,	'Vimpelcom IR iOS',	'vimpelcom-ir-ios',	'2013-01-14 18:24:11',	'2013-01-14 18:24:11',	'0',	'/1228.ipa',	'14.01',	'',	'',	1813,	0,	0,	'',	'apple@mobgen.com',	'',	'http://-alt.mobgen.com',	1,	0,	0,	'com.mobgen.VimpelComIR',	'dhbb91awq0iw',	0,	NULL,	1,	1358184251,	1358184251),
(1229,	'Vimpelcom IR iOS',	'vimpelcom-ir-ios',	'2013-01-15 15:43:54',	'2013-01-15 15:43:54',	'0',	'/1229.ipa',	'15.01',	'',	'',	1813,	0,	0,	'',	'apple@mobgen.com',	'',	'http://-alt.mobgen.com',	1,	0,	0,	'com.mobgen.VimpelComIR',	'vu97inwje7l2',	0,	NULL,	1,	1358261034,	1358261034),
(1230,	'VimpelCom IR iOS',	'vimpelcom-ir-ios',	'2013-01-16 10:24:06',	'2013-01-16 10:24:06',	'0',	'/1230.ipa',	'v1.0',	'',	'With Video',	1813,	0,	0,	'',	'',	'',	'http://-alt.mobgen.com',	1,	0,	0,	'com.mobgen.VimpelComIR',	'ez5yy3djo89y',	0,	NULL,	1,	1358328246,	1358328246),
(1231,	'VimpelCom IR iOS',	'vimpelcom-ir-ios',	'2013-01-16 10:27:15',	'2013-01-16 10:27:15',	'0',	'/1231.ipa',	'v1.0',	'',	'Without Video',	1813,	0,	0,	'',	'',	'',	'http://-alt.mobgen.com',	1,	0,	0,	'com.mobgen.VimpelComIR',	'9pnbd4h1ljsv',	0,	NULL,	1,	1358328435,	1358328435),
(1232,	'E-Control UK',	'e-control-uk',	'2013-01-17 15:00:09',	'2013-04-08 15:35:47',	'0',	'/1232.ipa',	'',	'',	'Video page added',	1295,	0,	0,	'',	'',	'',	'http://-alt.mobgen.com',	1,	0,	0,	'com.mobgen.meibes.uk',	'412icdf5mtl2',	0,	NULL,	1,	1358431209,	1365428147),
(1233,	'OnsOranje iPhone 18-01-2013',	'onsoranje-iphone-18-01-2013',	'2013-01-18 13:05:42',	'2013-01-21 13:47:51',	'0',	'/1233.ipa',	'',	'',	'',	1298,	0,	0,	'',	'',	'',	'http://-alt.mobgen.com',	1,	0,	0,	'com.mobgen.onsoranje.adhoc',	'owt53babhyke',	0,	NULL,	1,	1358510742,	1358772471),
(1234,	'Shell Inside Energy',	'shell-inside-energy',	'2013-01-18 17:20:16',	'2013-01-18 17:20:16',	'0',	'/1234.ipa',	'v1.4 807',	'',	'',	1035,	0,	0,	'Production',	'',	'',	'http://shellinno.mobgen.com',	1,	0,	0,	'com.mobgen.shellinnovation',	'4jfu8qc4s3pq',	0,	NULL,	1,	1358526016,	1358526016),
(1235,	'VL 2.0.0.12',	'vl-2-0-0-12',	'2013-01-22 11:53:56',	'2013-01-22 11:53:56',	'0',	'/1235.ipa',	'',	'',	'',	2680,	0,	0,	'debug',	'',	'',	'http://-alt.mobgen.com',	1,	0,	0,	'com.mobgen.vanlanschot',	'0ww5wjhwj1cx',	0,	NULL,	1,	1358852036,	1358852036),
(1236,	'Pre-Alpha',	'pre-alpha',	'2013-01-23 12:05:54',	'2013-01-23 12:05:54',	'0',	'/1236.ipa',	'0.1-debug',	'',	'',	1814,	0,	0,	'',	'',	'',	'http://-alt.mobgen.com',	1,	0,	0,	'com.mobgen.aegonenterprise',	'vr1vkmd1ct5k',	0,	NULL,	1,	1358939154,	1358939154),
(1237,	'Rhinetex v32',	'rhinetex-v32',	'2013-01-26 11:46:04',	'2013-01-26 11:46:04',	'0',	'/1237.ipa',	'v32',	'',	'',	1806,	0,	0,	'',	'apple@mobgen.com',	'',	'http://-alt.mobgen.com',	1,	0,	0,	'com.mobgen.mbs.rhinetex',	'2i2xb8aau3r',	0,	NULL,	1,	1359197164,	1359197164),
(1238,	'Pulse Overdue Android v0.6',	'pulse-overdue-android-v0-6',	'2013-01-28 16:51:53',	'2013-01-28 16:51:53',	'0',	'/1238.apk',	'v0.6',	'',	'',	1308,	0,	0,	'',	'',	'',	'http://-alt.mobgen.com',	1,	1,	0,	'com.mobgen.pulse.overdue',	'11s7zxm3n7mn',	0,	NULL,	1,	1359388313,	1359388313),
(1239,	'The Executive App',	'the-executive-app',	'2013-01-28 18:06:03',	'2013-01-28 18:17:35',	'0',	'/1239.ipa',	'0.9.2',	'',	'',	1302,	0,	0,	'Production',	'',	'',	'http://nibeapi.mobgen.com',	1,	0,	0,	'com.mobgen.NIBE',	'rwr8mfmcxias',	0,	NULL,	1,	1359392763,	1359393455),
(1240,	'The Executive App',	'the-executive-app',	'2013-01-29 18:44:58',	'2013-01-29 19:00:50',	'0',	'/1240.ipa',	'v0.9.3',	'',	'',	1302,	0,	0,	'Production',	'',	'',	'http://-alt.mobgen.com',	1,	0,	0,	'com.mobgen.NIBE',	'bv8cgk7fwtb8',	0,	NULL,	1,	1359481498,	1359482450),
(1241,	'E-Control UK Test',	'e-control-uk-test',	'2013-01-30 13:39:14',	'2013-02-24 22:03:19',	'',	'/1241.ipa',	'',	'',	'',	1295,	0,	0,	'',	'',	'',	'',	0,	0,	0,	'com.mobgen.meibes',	'rre2ta6b2e28',	0,	NULL,	1,	1359549554,	1361739799),
(1242,	'Shell Inside Energy',	'shell-inside-energy',	'2013-01-30 13:59:49',	'2013-01-30 13:59:49',	'0',	'/1242.ipa',	'1.4 808',	'',	'',	1035,	0,	0,	'Staging',	'',	'',	'http://shellinno-stage.mobgen.com',	1,	0,	0,	'com.mobgen.shellinnovation',	'rrfuj3uhax6z',	0,	NULL,	1,	1359550789,	1359550789),
(1243,	'Shell Inside Energy',	'shell-inside-energy',	'2013-01-30 16:25:48',	'2013-01-31 10:45:17',	'0',	'/1243.ipa',	'1.4 809',	'',	'',	1035,	0,	0,	'Staging',	'',	'',	'http://shellinno-stage.mobgen.com',	1,	0,	0,	'com.mobgen.shellinnovation',	'u0tzqobxj9y1',	0,	NULL,	1,	1359559548,	1359625517),
(1244,	'Pulse Overdue iOS v0.7',	'pulse-overdue-ios-v0-7',	'2013-02-01 11:04:04',	'2013-02-01 11:04:04',	'0',	'/1244.ipa',	'v0.7',	'',	'Added terms & conditions\r\nWorkaround Android 2.2 2.3 Webview issue\r\nImproved look & feel message logs\r\nInitiating a phone call or email from the invoice view is logged as a message\r\nWhen loading an activity indicator is shown\r\nAdded several choices to contact people by phone or mail on the invoice view',	1308,	0,	0,	'',	'apple@mobgen.com',	'',	'http://-alt.mobgen.com',	1,	0,	0,	'com.mobgen.pulse.overdue',	'6jbdzb3p0sc',	0,	NULL,	1,	1359713044,	1359713044),
(1245,	'The Executive App',	'the-executive-app',	'2013-02-01 18:04:07',	'2013-02-01 18:04:07',	'0',	'/1245.ipa',	'v0.9.5 dev',	'',	'',	1302,	0,	0,	' Development',	'',	'',	'http://-alt.mobgen.com',	1,	0,	0,	'com.mobgen.NIBE',	'hwqqdukez81k',	0,	NULL,	1,	1359738247,	1359738247),
(1246,	'ABN Research Morningstar',	'abn-research-morningstar',	'2013-02-04 10:23:14',	'2013-02-04 14:24:54',	'0',	'/1246.ipa',	'',	'',	'',	1807,	0,	0,	' release',	'',	'',	'http://-alt.mobgen.com',	1,	0,	0,	'com.mobgen.abn.privatebankinglight',	'g05mk4orptr2',	0,	NULL,	1,	1359969794,	1359984294),
(1247,	'wijnshaker 2013 05-02-2013',	'wijnshaker-2013-05-02-2013',	'2013-02-05 16:50:37',	'2013-02-05 17:06:35',	'0',	'/1247.ipa',	'',	'',	'',	1301,	0,	0,	'',	'',	'',	'http://-alt.mobgen.com',	1,	0,	0,	'com.mobgen.wijnshaker2013',	'4r9mnsiyobeq',	0,	NULL,	1,	1360079437,	1360080395),
(1248,	'OnsOranje 2.3',	'onsoranje-2-3',	'2013-02-06 10:29:22',	'2013-02-06 10:29:22',	'0',	'/1248.ipa',	'',	'',	'',	1298,	0,	0,	'',	'',	'',	'http://-alt.mobgen.com',	1,	0,	0,	'com.mobgen.onsoranje.adhoc',	'w0r7r28klmx',	0,	NULL,	1,	1360142962,	1360142962),
(1249,	'The Executive App',	'the-executive-app',	'2013-02-06 11:15:44',	'2013-02-06 11:15:44',	'0',	'/1249.ipa',	'1.0',	'',	'',	1302,	0,	0,	'Production',	'',	'',	'http://-alt.mobgen.com',	1,	0,	0,	'com.mobgen.NIBE',	'zkg1ihbasakx',	0,	NULL,	1,	1360145744,	1360145744),
(1250,	'ABN Research Pentest',	'abn-research-pentest',	'2013-02-08 10:31:41',	'2013-02-11 09:49:33',	'0',	'/1250.ipa',	'1.3',	'',	'',	1807,	0,	0,	' release',	'',	'',	'http://-alt.mobgen.com',	1,	0,	0,	'com.mobgen.abn.privatebanking',	'xf8ke2jw22j9',	0,	NULL,	1,	1360315901,	1360572573),
(1251,	'The Executive App',	'the-executive-app',	'2013-02-11 13:01:47',	'2013-02-11 13:59:53',	'0',	'/1251.ipa',	'1.0 performance evo',	'',	'',	1302,	0,	0,	'Production',	'',	'',	'http://-alt.mobgen.com',	1,	0,	0,	'com.mobgen.NIBE',	'c963926z063p',	0,	NULL,	1,	1360584107,	1360587593),
(1252,	'Rhinetex v34',	'rhinetex-v34',	'2013-02-12 11:30:26',	'2013-02-12 11:30:26',	'0',	'/1252.ipa',	'v34',	'',	'',	1806,	0,	0,	'',	'apple@mobgen.com',	'',	'http://-alt.mobgen.com',	1,	0,	0,	'com.mobgen.mbs.rhinetex',	'acpxp71f0s85',	0,	NULL,	1,	1360665026,	1360665026),
(1253,	'The Executive App',	'the-executive-app',	'2013-02-12 13:44:27',	'2013-02-12 17:27:45',	'0',	'/1253.ipa',	'1.0c',	'',	'',	1302,	0,	0,	'Production',	'',	'',	'http://-alt.mobgen.com',	1,	0,	0,	'com.mobgen.NIBE',	'nd2teiaoa7o8',	0,	NULL,	1,	1360673067,	1360686465),
(1254,	'Aegon 0.7',	'aegon-0-7',	'2013-02-15 17:46:23',	'2013-02-15 17:46:23',	'0',	'/1254.ipa',	'0.7',	'',	'',	1814,	0,	0,	'',	'',	'',	'http://-alt.mobgen.com',	1,	0,	0,	'com.mobgen.aegonenterprise',	'oe2isoqi0eg',	0,	NULL,	1,	1360946783,	1360946783),
(1255,	'Bavaria Compass Android 2013.02.18',	'bavaria-compass-android-2013-02-18',	'2013-02-18 10:28:34',	'2013-02-18 10:28:34',	'0',	'/1255.apk',	'2013.02.18',	'',	'',	2680,	0,	0,	'',	'',	'',	'http://-alt.mobgen.com',	1,	1,	0,	'com.mobgen.bavariacompass',	'hquvmm0v24ft',	0,	NULL,	1,	1361179714,	1361179714),
(1256,	'Shell IR',	'shell-ir',	'2013-02-18 16:44:12',	'2013-02-18 16:44:12',	'0',	'/1256.ipa',	'1.3.2 537',	'',	'',	1292,	0,	0,	'Production',	'',	'',	'http://shell-dev.mobgen.com',	1,	0,	0,	'com.mobgen.shellinvestormedia',	'ph7ao3dyut25',	0,	NULL,	1,	1361202252,	1361202252),
(1257,	'Aegon 0.8',	'aegon-0-8',	'2013-02-18 17:46:40',	'2013-02-18 17:56:05',	'0',	'/1257.ipa',	'0.8',	'',	'',	1814,	0,	0,	'',	'',	'',	'http://-alt.mobgen.com',	1,	0,	0,	'com.mobgen.aegonenterprise',	'frms1mdtiyz',	0,	NULL,	1,	1361206000,	1361206565),
(1258,	'The Executive App',	'the-executive-app',	'2013-02-18 18:53:20',	'2013-02-18 19:48:23',	'0',	'/1258.ipa',	'1.0.1',	'',	'',	1302,	0,	0,	' Development',	'',	'',	'http://.mobgen.com',	1,	0,	0,	'com.mobgen.NIBE',	'vcvd4mozl2s4',	0,	NULL,	1,	1361210000,	1361213303),
(1259,	'The Executive App',	'the-executive-app',	'2013-02-19 12:29:12',	'2013-02-19 12:29:12',	'0',	'/1259.ipa',	'1.0.4',	'',	'',	1302,	0,	0,	' Development',	'',	'',	'http://-alt.mobgen.com',	1,	0,	0,	'com.mobgen.NIBE',	'30sxcs581b8c',	0,	NULL,	1,	1361273352,	1361273352),
(1260,	'VL 2.0.0.28',	'vl-2-0-0-28',	'2013-02-19 13:02:57',	'2013-02-19 13:02:57',	'0',	'/1260.ipa',	'',	'',	'',	2680,	0,	0,	'debug',	'',	'',	'http://-alt.mobgen.com',	1,	0,	0,	'com.mobgen.vanlanschot',	'w5onitx7k3ui',	0,	NULL,	1,	1361275377,	1361275377),
(1261,	'Aegon RC',	'aegon-rc',	'2013-02-19 18:46:30',	'2013-02-19 18:46:30',	'0',	'/1261.ipa',	'RC',	'',	'',	1814,	0,	0,	'',	'',	'',	'http://-alt.mobgen.com',	1,	0,	0,	'com.mobgen.aegonenterprise',	'jr7t8h486m80',	0,	NULL,	1,	1361295990,	1361295990),
(1262,	'The Executive App',	'the-executive-app',	'2013-02-20 11:53:43',	'2013-02-20 11:53:43',	'0',	'/1262.ipa',	'1.0.6',	'',	'',	1302,	0,	0,	'Production',	'',	'',	'http://-alt.mobgen.com',	1,	0,	0,	'com.mobgen.NIBE',	'7k9hj2md9cj',	0,	NULL,	1,	1361357623,	1361357623),
(1263,	'Shell IR',	'shell-ir',	'2013-02-21 16:29:46',	'2013-02-21 17:54:34',	'0',	'/1263.ipa',	'1.3.2 358',	'',	'',	1292,	0,	0,	'Production',	'',	'',	'http://-alt.mobgen.com',	1,	0,	0,	'com.mobgen.shellinvestormedia',	'568ffdnzbsy',	0,	NULL,	1,	1361460586,	1361465674),
(1264,	'Aegon RC2',	'aegon-rc2',	'2013-02-21 17:50:36',	'2013-02-21 18:48:30',	'0',	'/1264.ipa',	'RC2',	'',	'',	1814,	0,	0,	'',	'',	'',	'http://-alt.mobgen.com',	1,	0,	0,	'com.mobgen.aegonenterprise',	'erz4ko3xu30',	0,	NULL,	1,	1361465436,	1361468910),
(1265,	'Aegon RC3',	'aegon-rc3',	'2013-02-22 10:25:48',	'2013-02-22 10:25:48',	'0',	'/1265.ipa',	'0.3',	'',	'',	1814,	0,	0,	'',	'',	'',	'http://-alt.mobgen.com',	1,	0,	0,	'com.mobgen.aegonenterprise',	'kkv2orggifvn',	0,	NULL,	1,	1361525148,	1361525148),
(1266,	'theCompass',	'thecompass',	'2013-02-22 10:31:13',	'2013-02-22 10:44:37',	'0',	'/1266.ipa',	'',	'',	'',	1818,	0,	0,	'debug',	'',	'',	'http://-alt.mobgen.com',	1,	0,	0,	'com.mobgen.bavaria-enterprise',	'5wxl0t7b3soh',	0,	NULL,	1,	1361525473,	1361526277),
(1267,	'The Executive App',	'the-executive-app',	'2013-02-22 12:41:49',	'2013-02-22 13:16:00',	'0',	'/1267.ipa',	'1.0.7',	'',	'',	1302,	0,	0,	'Production',	'',	'',	'http://-alt.mobgen.com',	1,	0,	0,	'com.mobgen.NIBE',	'0f9t1hldpj4j',	0,	NULL,	1,	1361533309,	1361535360),
(1268,	'Shell Inside Energy',	'shell-inside-energy',	'2013-02-25 13:45:32',	'2013-02-25 13:45:32',	'0',	'/1268.ipa',	'1.4 810',	'',	'',	1035,	0,	0,	'Staging',	'',	'',	'http://shellinno-stage.mobgen.com',	1,	0,	0,	'com.mobgen.shellinnovation',	'cy7o7oeluyiw',	0,	NULL,	1,	1361796332,	1361796332),
(1269,	'Aegon 1.0',	'aegon-1-0',	'2013-02-25 15:36:19',	'2013-02-25 15:36:19',	'0',	'/1269.ipa',	'1.0',	'',	'',	1814,	0,	0,	'',	'',	'',	'http://-alt.mobgen.com',	1,	0,	0,	'com.mobgen.aegonenterprise',	'ggjiramu874s',	0,	NULL,	1,	1361802979,	1361802979),
(1270,	'Shell Inside Energy',	'shell-inside-energy',	'2013-02-25 18:14:49',	'2013-02-25 18:18:51',	'0',	'/1270.ipa',	'1.4 814',	'',	'',	1035,	0,	0,	'Alternative',	'',	'',	'http://shellinno-alt.mobgen.com',	1,	0,	0,	'com.mobgen.shellinnovation',	'5os4uxekx4n',	0,	NULL,	1,	1361812489,	1361812731),
(1271,	'Shell Inside Energy',	'shell-inside-energy',	'2013-02-25 18:18:31',	'2013-02-25 18:18:31',	'0',	'/1271.ipa',	'1.4 815',	'',	'',	1035,	0,	0,	'Production',	'',	'',	'http://shellinno.mobgen.com',	1,	0,	0,	'com.mobgen.shellinnovation',	'30tcygvo6c6y',	0,	NULL,	1,	1361812711,	1361812711),
(1272,	'the Compass',	'the-compass',	'2013-02-26 09:24:33',	'2013-03-07 09:21:57',	'0',	'/1272.ipa',	'',	'',	'',	1818,	0,	0,	'debug',	'',	'',	'http://-alt.mobgen.com',	1,	0,	0,	'com.mobgen.bavaria-enterprise',	'sqfwmn64pyeq',	0,	NULL,	1,	1361867073,	1362644517),
(1273,	'ABN ZZP',	'abn-zzp',	'2013-02-26 11:34:08',	'2013-02-26 11:34:08',	'0',	'/1273.ipa',	'1.10',	'',	'- gps no longer required to install app\r\n- localization changed to dutch online\r\n- omniture has been disabled\r\n- splash screen iPad fixed\r\n- proper iPad support added',	1307,	0,	0,	'',	'',	'',	'http://-alt.mobgen.com',	1,	0,	0,	'com.mobgen.abn.zzp',	'm9rys9etey2z',	0,	NULL,	1,	1361874848,	1361874848),
(1275,	'WhoIsWho2',	'whoiswho2',	'2013-02-26 15:29:44',	'2013-02-26 15:30:01',	'0',	'/1275.ipa',	'',	'',	'',	1294,	0,	0,	' iOS',	'',	'',	'http://-alt.mobgen.com',	1,	0,	0,	'com.mobgen.whoiswhoenterprise',	'86l1p9yid6as',	0,	NULL,	1,	1361888984,	1361889001),
(1276,	'ABN ZZP',	'abn-zzp',	'2013-02-26 17:17:52',	'2013-02-26 17:17:52',	'0',	'/1276.ipa',	'1.10.1',	'',	'added .csv extension to ios5 file export',	1307,	0,	0,	'',	'',	'',	'http://-alt.mobgen.com',	1,	0,	0,	'com.mobgen.abn.zzp',	'72m1afzsfuu9',	0,	NULL,	1,	1361895472,	1361895472),
(1277,	'KPMG 2 0.1',	'kpmg-2-0-1',	'2013-02-27 13:22:58',	'2013-03-08 17:07:10',	'0',	'/1277.ipa',	'0.1-debug',	'',	'',	1811,	0,	0,	'debug',	'',	'',	'http://-alt.mobgen.com',	1,	0,	0,	'com.mobgen.kpmg',	'mcttswdnk6ul',	0,	NULL,	1,	1361967778,	1362758830),
(1278,	'Pulse Overdue Android v0.8',	'pulse-overdue-android-v0-8',	'2013-02-28 16:48:59',	'2013-02-28 16:48:59',	'0',	'/1278.apk',	'v0.8',	'',	'Implemented compulsory T&C acceptance, password change functionality, internationalization (nl and en present), fixed android back button, lock timeout, description padding.',	1308,	0,	0,	'',	'',	'',	'http://-alt.mobgen.com',	1,	1,	0,	'com.mobgen.pulse.overdue',	'rnz2510sx5c8',	0,	NULL,	1,	1362066539,	1362066539),
(1279,	'Talk Cards Eng - Spa',	'talk-cards-eng-spa',	'2013-03-01 11:11:57',	'2013-03-04 17:03:44',	'0',	'/1279.ipa',	'',	'',	'',	1310,	0,	0,	'',	'',	'',	'http://-alt.mobgen.com',	1,	0,	1,	'com.mobgen.talkmemory.enes',	'i7aat446h9k',	0,	NULL,	1,	1362132717,	1362413024),
(1280,	'The Executive App',	'the-executive-app',	'2013-03-01 11:54:03',	'2013-03-01 14:54:01',	'0',	'/1280.ipa',	'1.0.8',	'',	'',	1302,	0,	0,	'Production',	'',	'',	'http://-alt.mobgen.com',	1,	0,	0,	'com.mobgen.NIBE',	'aaq7zmwck6zj',	0,	NULL,	1,	1362135243,	1362146041),
(1281,	'The Executive App',	'the-executive-app',	'2013-03-01 16:52:10',	'2013-03-01 17:34:38',	'0',	'/1281.ipa',	'1.0.9',	'',	'',	1302,	0,	0,	'Production',	'',	'',	'http://-alt.mobgen.com',	1,	0,	0,	'com.mobgen.NIBE',	'va585b64u826',	0,	NULL,	1,	1362153130,	1362155678),
(1282,	'The Executive App',	'the-executive-app',	'2013-03-01 18:22:56',	'2013-03-01 18:22:56',	'0',	'/1282.ipa',	'1.0 App Store',	'',	'',	1302,	0,	0,	'Production',	'',	'',	'http://-alt.mobgen.com',	1,	0,	0,	'com.mobgen.NIBE',	'mcqllr0ofydm',	0,	NULL,	1,	1362158576,	1362158576),
(1283,	'The Executive app',	'the-executive-app',	'2013-03-04 12:59:32',	'2013-03-04 12:59:32',	'0',	'/1283.ipa',	'',	'',	'',	1302,	0,	0,	'Production',	'',	'',	'http://-alt.mobgen.com',	1,	0,	0,	'com.mobgen.NIBE',	'se38sm80qljx',	0,	NULL,	1,	1362398372,	1362398372),
(1284,	'VL Build 43',	'vl-build-43',	'2013-03-04 13:24:54',	'2013-03-04 13:24:54',	'0',	'/1284.ipa',	'',	'',	'',	2680,	0,	0,	'debug',	'',	'',	'http://-alt.mobgen.com',	1,	0,	0,	'com.mobgen.vanlanschot',	'9tu40oe41i9d',	0,	NULL,	1,	1362399894,	1362399894),
(1298,	'ShellInnovation',	'shellinnovation',	'2012-06-19 18:17:01',	'2012-06-19 18:17:01',	'2',	'/1298.ipa',	'1.3.24-784',	'',	'',	1035,	0,	0,	'Alternative',	'tech@mobgen.com',	'',	'http://shellinno-alt.mobgen.com',	1,	0,	0,	'com.mobgen.shellinnovation',	'ahbrdpgn45n',	0,	NULL,	1,	1340122621,	1340122621),
(1299,	'ShellInnovation',	'shellinnovation',	'2012-06-19 18:29:26',	'2012-06-26 14:09:53',	'2',	'/1299.ipa',	'1.3.24-784',	'',	'Last try',	1035,	0,	0,	'Production',	'tech@mobgen.com',	'',	'http://shellinno-alt.mobgen.com',	1,	0,	0,	'com.mobgen.shellinnovation',	'3xicunp2flpc',	0,	NULL,	1,	1340123366,	1340712593),
(1300,	'ShellInnovation',	'shellinnovation',	'2012-06-26 14:57:28',	'2012-07-16 18:21:21',	'2',	'/1300.ipa',	'1.3.24-785',	'',	'',	1035,	0,	0,	'Alternative',	'tech@mobgen.com',	'',	'http://shellinno-alt.mobgen.com',	1,	0,	0,	'com.mobgen.shellinnovation',	'dklkh1zt1dgt',	0,	NULL,	1,	1340715448,	1342455681),
(1301,	'Shell Investor Media 1.3 ',	'shell-investor-media-1-3',	'2012-06-26 18:50:59',	'2012-06-26 18:50:59',	'0',	'/1301.ipa',	'1.2.5 325',	'',	'',	1292,	0,	0,	'Alternative',	'tech@mobgen.com',	'',	'http://shell-alt.mobgen.com',	1,	0,	0,	'com.mobgen.shellinvestormedia',	'md56ipivp4ri',	0,	NULL,	1,	1340729459,	1340729459),
(1302,	'Shell Investor Media',	'shell-investor-media',	'2012-06-27 12:31:06',	'2012-06-29 10:43:15',	'0',	'/1302.ipa',	'1.2.5 326',	'',	'',	1292,	0,	0,	'Alternative',	'tech@mobgen.com',	'',	'http://shell-alt.mobgen.com',	1,	0,	0,	'com.mobgen.shellinvestormedia',	'd9gpoml25k1e',	0,	NULL,	1,	1340793066,	1340959395),
(1305,	'Shell IR',	'shell-ir',	'2012-07-06 16:12:43',	'2012-07-06 16:12:43',	'0',	'/1305.apk',	'1.4.4',	'',	'',	1292,	0,	0,	'Development',	'',	'',	'http://-alt.mobgen.com',	1,	1,	0,	'com.mobgen.shellir',	'8n6tnguyn5tx',	0,	NULL,	1,	1341583963,	1341583963),
(1307,	'Lifespotters 2012-07-09',	'lifespotters-2012-07-09',	'2012-07-09 15:26:30',	'2012-07-09 15:26:30',	'0',	'/1307.ipa',	'r15',	'',	'',	2680,	0,	0,	'development',	'apple@mobgen.com',	'',	'http://-alt.mobgen.com',	1,	0,	0,	'com.mobgen.lifespottersenterprise',	'wl5c9dti6uqx',	0,	NULL,	1,	1341840390,	1341840390),
(1308,	'Lifespotters 2012-07-11',	'lifespotters-2012-07-11',	'2012-07-11 13:11:52',	'2012-07-11 13:11:52',	'0',	'/1308.ipa',	'r16',	'',	'',	2680,	0,	0,	'development',	'apple@mobgen.com',	'',	'http://-alt.mobgen.com',	1,	0,	0,	'com.mobgen.lifespottersenterprise',	'r9p8uf00fd',	0,	NULL,	1,	1342005112,	1342005112),
(1309,	'Lifespotters 2012-07-12',	'lifespotters-2012-07-12',	'2012-07-12 16:54:50',	'2012-07-12 16:54:50',	'0',	'/1309.ipa',	'r17',	'',	'',	2680,	0,	0,	'development',	'apple@mobgen.com',	'',	'http://-alt.mobgen.com',	1,	0,	0,	'com.mobgen.lifespottersenterprise',	'0w9uc0zd9c6h',	0,	NULL,	1,	1342104890,	1342104890),
(1310,	'Lifespotters 2012-07-19\'',	'lifespotters-2012-07-19',	'2012-07-19 14:07:06',	'2012-07-19 14:07:06',	'0',	'/1310.ipa',	'r20',	'',	'',	2680,	0,	0,	'development',	'apple@mobgen.com',	'',	'http://-alt.mobgen.com',	1,	0,	0,	'com.mobgen.lifespottersenterprise',	'r5kp4j242dxy',	0,	NULL,	1,	1342699626,	1342699626),
(1312,	'Who is who 31-07-2012',	'who-is-who-31-07-2012',	'2012-07-31 17:00:56',	'2012-08-24 14:29:55',	'0',	'/1312.ipa',	'r01',	'',	'TEST',	1294,	0,	0,	'',	'apple@mobgen.com',	'',	'http://-alt.mobgen.com',	1,	0,	1,	'com.melior.safecat',	'46q2hicpl4us',	0,	NULL,	1,	1343746856,	1345811395),
(1314,	'Dummy.0.01.alt',	'dummy-0-01-alt',	'2012-08-13 16:55:09',	'2012-08-13 17:02:40',	'0',	'/1314.ipa',	'0.01',	'',	'',	2680,	0,	0,	'',	'tech@mobgen.com',	'',	'http://Dummy-alt.mobgen.com',	1,	0,	0,	'com.mobgen.shellinnovation',	'ot04n88ihat',	0,	NULL,	1,	1344869709,	1344870160),
(1315,	'E-control_15082012',	'e-control-15082012',	'2012-08-15 09:35:31',	'2012-08-15 09:51:35',	'0',	'/1315.ipa',	'0.1',	'',	'-',	1295,	0,	0,	'',	'apple@mobgen.com',	'',	'http://-alt.mobgen.com',	1,	0,	0,	'com.mobgen.meibes',	'1qg1mp2nt8uq',	0,	NULL,	1,	1345016131,	1345017095),
(1552,	'Shell Innovation',	'shell-innovation',	'2012-08-16 18:01:56',	'2012-08-20 12:16:36',	'2',	'/1552.ipa',	'1.3.24 787',	'',	'',	1035,	0,	0,	'Alternative',	'tech@mobgen.com',	'',	'http://shellinno-alt.mobgen.com',	1,	0,	0,	'com.mobgen.shellinnovation',	'xw2gondbyajm',	0,	NULL,	1,	1345132916,	1345457796),
(1553,	'VL 2012-08-17',	'vl-2012-08-17',	'2012-08-17 16:17:56',	'2012-08-17 16:17:56',	'0',	'/1553.ipa',	'',	'',	'',	2680,	0,	0,	'debug',	'',	'',	'http://-alt.mobgen.com',	1,	0,	0,	'com.mobgen.vanlanschot',	'9x1093wh221g',	0,	NULL,	1,	1345213076,	1345213076),
(1554,	'VL 2012-08-17 (2)',	'vl-2012-08-17-2',	'2012-08-17 17:44:05',	'2012-08-17 17:44:05',	'0',	'/1554.ipa',	'',	'',	'',	2680,	0,	0,	'debug',	'',	'',	'http://-alt.mobgen.com',	1,	0,	0,	'com.mobgen.vanlanschot',	'kzvp53v97ax',	0,	NULL,	1,	1345218245,	1345218245),
(1555,	'OnsOranje iPhone 21-8-2012',	'onsoranje-iphone-21-8-2012',	'2012-08-21 14:29:39',	'2012-08-21 14:29:39',	'0',	'/1555.ipa',	'r01',	'',	'',	1298,	0,	0,	'',	'apple@mobgen.com',	'',	'http://-alt.mobgen.com',	1,	0,	0,	'com.mobgen.onsoranje',	'b2ndzpu7d4m',	0,	NULL,	1,	1345552179,	1345552179),
(1556,	'OnsOranje iPad 21-8-2012',	'onsoranje-ipad-21-8-2012',	'2012-08-21 14:32:59',	'2012-08-21 14:32:59',	'0',	'/1556.ipa',	'r01',	'',	'',	1299,	0,	0,	'',	'apple@mobgen.com',	'',	'http://-alt.mobgen.com',	1,	0,	0,	'com.mobgen.onsoranjeHD',	'4ea68yupedqk',	0,	NULL,	1,	1345552379,	1345552379),
(1557,	'Lifespotters 2012-08-21\'\'',	'lifespotters-2012-08-21',	'2012-08-21 15:54:15',	'2012-08-21 15:54:15',	'0',	'/1557.ipa',	'r25',	'',	'',	2680,	0,	0,	'development',	'apple@mobgen.com',	'',	'http://-alt.mobgen.com',	1,	0,	0,	'com.mobgen.lifespotters',	'atvz57498g5l',	0,	NULL,	1,	1345557255,	1345557255),
(1558,	'Lifespotters 2012-08-21\'\'\'',	'lifespotters-2012-08-21',	'2012-08-21 16:00:05',	'2012-08-21 16:00:05',	'0',	'/1558.ipa',	'r26',	'',	'',	2680,	0,	0,	'development',	'apple@mobgen.com',	'',	'http://-alt.mobgen.com',	1,	0,	0,	'com.mobgen.lifespottersenterprise',	'o57zsexm5hg',	0,	NULL,	1,	1345557605,	1345557605),
(1559,	'OnsOranje iPhone 27-8-2012 3',	'onsoranje-iphone-27-8-2012-3',	'2012-08-27 14:47:57',	'2012-08-27 14:47:57',	'0',	'/1559.ipa',	'r04',	'',	'',	1298,	0,	0,	'',	'apple@mobgen.com',	'',	'http://-alt.mobgen.com',	1,	0,	0,	'com.mobgen.onsoranje.adhoc',	'ks2l2zqkaws0',	0,	NULL,	1,	1346071677,	1346071677),
(1560,	'OnsOranje iPad 27-8-2012 4',	'onsoranje-ipad-27-8-2012-4',	'2012-08-27 14:52:35',	'2012-08-27 14:52:35',	'0',	'/1560.ipa',	'r05',	'',	'',	1299,	0,	0,	'',	'apple@mobgen.com',	'',	'http://-alt.mobgen.com',	1,	0,	0,	'com.mobgen.onsoranjeHD.adhoc',	'897wo3u0fjas',	0,	NULL,	1,	1346071955,	1346071955),
(1561,	'VL 2012-08-28',	'vl-2012-08-28',	'2012-08-28 09:45:15',	'2012-08-28 09:47:24',	'0',	'/1561.ipa',	'',	'',	'',	2680,	0,	0,	'debug',	'',	'',	'http://-alt.mobgen.com',	1,	0,	0,	'com.mobgen.vanlanschot',	'94rktv6pwjg',	0,	NULL,	1,	1346139915,	1346140044),
(1562,	'VL 2012-08-28 Beta 1.0',	'vl-2012-08-28-beta-1-0',	'2012-08-28 17:07:16',	'2012-08-28 17:07:16',	'0',	'/1562.ipa',	'Beta 1.0',	'',	'',	2680,	0,	0,	'debug',	'',	'',	'http://-alt.mobgen.com',	1,	0,	0,	'com.mobgen.vanlanschot',	'gy6r5m1t7goi',	0,	NULL,	1,	1346166436,	1346166436),
(1563,	'VL 2012-08-29 Beta 1.1 mobile.vipinvest.nl',	'vl-2012-08-29-beta-1-1-mobile-vipinvest-nl',	'2012-08-29 17:40:14',	'2012-08-29 17:40:14',	'0',	'/1563.ipa',	'',	'',	'',	2680,	0,	0,	' release',	'',	'',	'http://-alt.mobgen.com',	1,	0,	0,	'com.mobgen.vanlanschot',	'7hkiy7k8yrjy',	0,	NULL,	1,	1346254814,	1346254814),
(1564,	'VL 2012-08-30 Test',	'vl-2012-08-30-test',	'2012-08-30 10:45:38',	'2012-08-30 10:45:38',	'0',	'/1564.ipa',	'',	'',	'',	2680,	0,	0,	'debug',	'',	'',	'http://-alt.mobgen.com',	1,	0,	0,	'com.mobgen.vanlanschot',	'6isqok6l8pdv',	0,	NULL,	1,	1346316338,	1346316338),
(1565,	'VL 2012-08-31 Beta 1.3',	'vl-2012-08-31-beta-1-3',	'2012-08-31 17:42:16',	'2012-08-31 17:42:16',	'0',	'/1565.ipa',	'Beta 1.3',	'',	'',	2680,	0,	0,	' release',	'',	'',	'http://-alt.mobgen.com',	1,	0,	0,	'com.mobgen.vanlanschot',	'1s1cr9puoo0',	0,	NULL,	1,	1346427736,	1346427736),
(1566,	'Who is who 4-09-2012',	'who-is-who-4-09-2012',	'2012-09-04 12:20:07',	'2012-09-04 12:20:07',	'0',	'/1566.ipa',	'r02',	'',	'',	1294,	0,	0,	'',	'apple@mobgen.com',	'',	'http://-alt.mobgen.com',	1,	0,	0,	'com.mobgen.whoiswhoenterprise',	'ceg9ts2527q',	0,	NULL,	1,	1346754007,	1346754007),
(1568,	'piccolo.04.09',	'piccolo-04-09',	'2012-09-05 14:37:54',	'2012-09-06 09:54:17',	'0',	'/1568.ipa',	'',	'',	'',	1549,	0,	0,	'',	'',	'',	'http://-alt.mobgen.com',	1,	0,	1,	'com.piccolo.bookstore.world',	'm5gt0m4xmq6y',	0,	NULL,	1,	1346848674,	1346918057),
(1569,	'Deal with it',	'deal-with-it',	'2012-09-05 15:33:57',	'2014-04-15 11:02:19',	'0',	'/1569.ipa',	'1.1',	'',	'Re-signed. Adapted to iOS 7.1 SDK',	1805,	0,	0,	' release',	'',	'',	'http://-alt.mobgen.com',	1,	0,	0,	'com.mobgen.bavaria-enterprise',	'9l0syvqdw1w',	0,	NULL,	1,	1346852037,	1397552539),
(1570,	'WjinShaker2013 1',	'wjinshaker2013-1',	'2012-09-05 16:25:12',	'2012-09-05 16:41:27',	'2',	'/1570.ipa',	'2.2',	'',	'',	2680,	0,	0,	'',	'apple@mobgen.com',	'',	'http://-alt.mobgen.com',	1,	0,	0,	'com.mobgen.wijnshaker2013',	'4fy39crx0wug',	0,	NULL,	1,	1346855112,	1346856087),
(1571,	'Rhinetex v1',	'rhinetex-v1',	'2012-09-06 10:02:48',	'2012-09-06 10:02:48',	'0',	'/1571.ipa',	'1',	'',	'',	1806,	0,	0,	'',	'apple@mobgen.com',	'',	'http://-alt.mobgen.com',	1,	0,	1,	'com.mobgen.mbs.rhinetex',	'w0fkt5wzk1p4',	0,	NULL,	1,	1346918568,	1346918568),
(1572,	'Rhinetex v1b',	'rhinetex-v1b',	'2012-09-06 12:27:08',	'2012-09-06 12:27:08',	'0',	'/1572.ipa',	'2',	'',	'',	1806,	0,	0,	'',	'apple@mobgen.com',	'',	'http://-alt.mobgen.com',	1,	0,	1,	'*',	'kysdwgv75wx7',	0,	NULL,	1,	1346927228,	1346927228),
(1573,	'Rhinetex v1d',	'rhinetex-v1d',	'2012-09-06 12:44:52',	'2012-09-06 12:46:48',	'0',	'/1573.ipa',	'4',	'',	'',	1806,	0,	0,	'',	'apple@mobgen.com',	'',	'http://-alt.mobgen.com',	1,	0,	0,	'com.mobgen.mbs.rhinetex',	'wzxkwaf622hy',	0,	NULL,	1,	1346928292,	1346928408),
(1574,	'WijnShaker2013',	'wijnshaker2013',	'2012-09-06 17:06:56',	'2012-09-06 17:08:45',	'0',	'/1574.ipa',	'2.3',	'',	'',	1301,	0,	0,	'',	'apple@mobgen.com',	'',	'http://-alt.mobgen.com',	1,	0,	0,	'com.mobgen.wijnshaker2013',	'b1nioxzqxj2a',	0,	NULL,	1,	1346944016,	1346944125),
(1575,	'Rhinetex v5',	'rhinetex-v5',	'2012-09-06 17:29:30',	'2012-09-06 17:29:30',	'0',	'/1575.ipa',	'5',	'',	'',	1806,	0,	0,	'',	'apple@mobgen.com',	'',	'http://-alt.mobgen.com',	1,	0,	0,	'com.mobgen.mbs.rhinetex',	'avthuz9btrl',	0,	NULL,	1,	1346945370,	1346945370),
(1576,	'Piccolo 07.09',	'piccolo-07-09',	'2012-09-07 13:04:01',	'2012-09-07 13:39:20',	'0',	'/1576.ipa',	'07.09.2012',	'',	'',	1549,	0,	0,	'',	'',	'',	'http://-alt.mobgen.com',	1,	0,	1,	'com.piccolo.bookstore.world',	'rk9rgpneb6b',	0,	NULL,	1,	1347015841,	1347017960),
(1577,	'NIBE SVV Beta Preview',	'nibe-svv-beta-preview',	'2012-09-07 14:04:43',	'2012-09-07 14:06:01',	'0',	'/1577.ipa',	'0.1',	'',	'',	1302,	0,	0,	'',	'apple@mobgen.com',	'',	'http://-alt.mobgen.com',	1,	0,	0,	'com.mobgen.NIBE',	'5jnjhh6nw3jc',	0,	NULL,	1,	1347019483,	1347019561),
(1578,	'Rhinetex v6',	'rhinetex-v6',	'2012-09-10 11:16:55',	'2012-09-10 11:16:55',	'0',	'/1578.ipa',	'6',	'',	'',	1806,	0,	0,	'',	'apple@mobgen.com',	'',	'http://-alt.mobgen.com',	1,	0,	0,	'com.mobgen.mbs.rhinetex',	'8daa22zckst8',	0,	NULL,	1,	1347268615,	1347268615),
(1579,	'WijnShaker2013 1',	'wijnshaker2013-1',	'2012-09-10 11:19:52',	'2012-09-10 11:33:48',	'0',	'/1579.ipa',	'2.3',	'',	'',	1301,	0,	0,	'',	'apple@mobgen.com',	'',	'http://-alt.mobgen.com',	1,	0,	0,	'com.mobgen.wijnshaker2013',	'fnenqlqqfbna',	0,	NULL,	1,	1347268792,	1347269628),
(1580,	'VL Test 2012-09-10',	'vl-test-2012-09-10',	'2012-09-10 11:59:08',	'2012-09-10 11:59:08',	'0',	'/1580.ipa',	'',	'',	'',	2680,	0,	0,	' release',	'',	'',	'http://-alt.mobgen.com',	1,	0,	0,	'com.mobgen.vanlanschot',	'nthhjxj1f1dy',	0,	NULL,	1,	1347271148,	1347271148),
(1581,	'VL 2012-09-11 Beta 1.6',	'vl-2012-09-11-beta-1-6',	'2012-09-11 16:10:11',	'2012-09-11 16:10:11',	'0',	'/1581.ipa',	'',	'',	'',	2680,	0,	0,	' release',	'',	'',	'http://-alt.mobgen.com',	1,	0,	0,	'com.mobgen.vanlanschot',	'1sfbs6upy4s',	0,	NULL,	1,	1347372611,	1347372611),
(1582,	'WijnShaker 2013 2',	'wijnshaker-2013-2',	'2012-09-12 10:32:00',	'2012-09-12 10:34:09',	'0',	'/1582.ipa',	'2.3',	'',	'',	1301,	0,	0,	'',	'apple@mobgen.com',	'',	'http://-alt.mobgen.com',	1,	0,	0,	'com.mobgen.wijnshaker2013',	'z2s5yoi9wiz6',	0,	NULL,	1,	1347438720,	1347438849),
(1583,	'Mobgen Investor 1.0 (ABN)',	'mobgen-investor-1-0-abn',	'2012-09-12 16:38:11',	'2012-09-12 17:13:55',	'0',	'/1583.ipa',	'',	'',	'',	2680,	0,	0,	'debug',	'apple@mobgen.com',	'',	'http://-alt.mobgen.com',	1,	0,	0,	'com.mobgen.vlwhitelabel',	'q3vl4uva3w40',	0,	NULL,	1,	1347460691,	1347462835),
(1584,	'Van Lanschot 1.2 (ABN)',	'van-lanschot-1-2-abn',	'2012-09-13 09:37:48',	'2012-10-31 17:44:12',	'0',	'/1584.ipa',	'0.002',	'',	'CHANGE PASSWORD ENCRIPTION FOR KPMG ONE LOG IN',	2680,	0,	0,	'',	'apple@mobgen.com',	'',	'http://-alt.mobgen.com',	1,	0,	0,	'com.mobgen.kpmg',	'elmv08hj7t80',	0,	NULL,	1,	1347521868,	1351701852),
(1585,	'vl abn 1.3',	'vl-abn-1-3',	'2012-09-13 09:53:55',	'2012-09-13 11:03:19',	'0',	'/1585.ipa',	'1.3',	'',	'',	2680,	0,	0,	'debug',	'apple@mobgen.com',	'',	'http://-alt.mobgen.com',	1,	0,	0,	'com.mobgen.vlwhitelabel',	'elzu2gfcrlr',	0,	NULL,	1,	1347522835,	1347526999),
(1586,	'vl abn 1.3',	'vl-abn-1-3',	'2012-09-13 10:27:54',	'2012-09-13 10:28:27',	'0',	'/1586.ipa',	'1.3',	'',	'',	2680,	0,	0,	'debug',	'apple@mobgen.com',	'',	'http://-alt.mobgen.com',	1,	0,	0,	'com.mobgen.vlwhitelabel',	'dseq0fga2lo9',	0,	NULL,	1,	1347524874,	1347524907),
(1587,	'Rhinetex v9',	'rhinetex-v9',	'2012-09-13 23:46:06',	'2012-09-13 23:46:06',	'0',	'/1587.ipa',	'9',	'',	'',	1806,	0,	0,	'',	'apple@mobgen.com',	'',	'http://-alt.mobgen.com',	1,	0,	0,	'com.mobgen.mbs.rhinetex',	'g345vupkyqw',	0,	NULL,	1,	1347572766,	1347572766),
(1588,	'VL 2012-09-14 Beta 1.7',	'vl-2012-09-14-beta-1-7',	'2012-09-14 14:55:59',	'2012-09-14 15:04:56',	'0',	'/1588.ipa',	'',	'',	'',	2680,	0,	0,	'debug',	'',	'',	'http://-alt.mobgen.com',	1,	0,	0,	'com.mobgen.vanlanschot',	'b5hnfyc4xwzj',	0,	NULL,	1,	1347627359,	1347627896),
(1590,	'ABN Research Light 1.1',	'abn-research-light-1-1',	'2012-09-18 13:33:26',	'2012-09-18 13:50:09',	'0',	'/1590.ipa',	'1.1 beta',	'',	'',	1807,	0,	0,	'debug',	'',	'',	'http://-alt.mobgen.com',	1,	0,	0,	'com.mobgen.abn.privatebankinglight',	'b0jozwion830',	0,	NULL,	1,	1347968006,	1347969009),
(1591,	'Final Production Build ',	'final-production-build',	'2012-09-19 12:26:29',	'2012-09-28 10:43:19',	'1',	'/1591.ipa',	'Final - Live ',	'',	'',	1808,	0,	0,	'Production - final ',	'apple@mobgen.com',	'',	'http://-alt.mobgen.com',	1,	0,	0,	'com.mobgen.abn.privatebanking',	'mnwvpdbazepr',	0,	NULL,	1,	1348050389,	1348821799),
(1592,	'Redevco ',	'redevco',	'2012-09-19 13:20:00',	'2012-11-12 13:26:19',	'0',	'/1592.ipa',	'Never released  ',	'',	'',	1303,	0,	0,	'Old version ',	'apple@mobgen.com',	'',	'http://-alt.mobgen.com',	1,	0,	0,	'com.mobgen.redevco.app',	'qp73vyemsal5',	0,	NULL,	1,	1348053600,	1352723179),
(1593,	'ABN Research Light 1.2',	'abn-research-light-1-2',	'2012-09-19 15:32:25',	'2012-09-19 17:34:34',	'0',	'/1593.ipa',	'1.2 beta',	'',	'',	1807,	0,	0,	'debug',	'',	'',	'http://-alt.mobgen.com',	1,	0,	0,	'com.mobgen.abn.privatebankinglight',	'iwmmoshk7x73',	0,	NULL,	1,	1348061545,	1348068874),
(1594,	'Command line build',	'command-line-build',	'2012-09-19 15:48:27',	'2012-09-19 15:48:27',	'0',	'/1594.ipa',	'',	'',	'',	1805,	0,	0,	'debug',	'',	'',	'http://-alt.mobgen.com',	1,	0,	0,	'com.mobgen.vanlanschot',	'wzajpirgdo5c',	0,	NULL,	1,	1348062507,	1348062507),
(1595,	'VL Test feed beta 1.7',	'vl-test-feed-beta-1-7',	'2012-09-20 10:17:43',	'2012-09-20 11:16:36',	'0',	'/1595.ipa',	'',	'',	'',	2680,	0,	0,	'debug',	'',	'',	'http://-alt.mobgen.com',	1,	0,	0,	'com.mobgen.vanlanschot',	'0h3t6pwue3ve',	0,	NULL,	1,	1348129063,	1348132596),
(1596,	'E-Control 20-09-2012',	'e-control-20-09-2012',	'2012-09-20 16:15:23',	'2012-10-02 13:55:37',	'0',	'/1596.ipa',	'r03',	'',	'',	1295,	0,	0,	'',	'apple@mobgen.com',	'',	'http://-alt.mobgen.com',	1,	0,	0,	'com.mobgen.meibes',	'1e93sxjjukg4',	0,	NULL,	1,	1348150523,	1349178937),
(1597,	'Audio beta 2',	'audio-beta-2',	'2012-09-24 13:30:31',	'2012-09-24 13:30:31',	'0',	'/1597.ipa',	'',	'',	'',	1809,	0,	0,	'debug',	'',	'',	'http://-alt.mobgen.com',	1,	0,	0,	'com.mobgen.abn.publicationapp',	'7887t9wc3a8o',	0,	NULL,	1,	1348486231,	1348486231),
(1598,	'Audio beta 3',	'audio-beta-3',	'2012-09-24 15:45:32',	'2012-09-24 15:45:32',	'0',	'/1598.ipa',	'',	'',	'Built with ios 5 sdk',	1809,	0,	0,	'debug',	'',	'',	'http://-alt.mobgen.com',	1,	0,	0,	'com.mobgen.abn.publicationapp',	'k3ylrh715whm',	0,	NULL,	1,	1348494332,	1348494332),
(1599,	'Re sign',	're-sign',	'2012-09-24 17:25:29',	'2012-09-24 17:25:29',	'0',	'/1599.ipa',	'',	'',	'',	1805,	0,	0,	'debug',	'',	'',	'http://-alt.mobgen.com',	1,	0,	0,	'com.mobgen.wijnshaker2013',	'awch9vpm6l7i',	0,	NULL,	1,	1348500329,	1348500329),
(1600,	'Sales Presenter',	'sales-presenter',	'2012-09-25 09:39:55',	'2012-09-25 09:39:55',	'0',	'/1600.ipa',	'',	'',	'',	1810,	0,	0,	'debug',	'',	'',	'http://-alt.mobgen.com',	1,	0,	1,	'com.mobgen.redevco2Trial',	'anxra5zsbaj',	0,	NULL,	1,	1348558795,	1348558795),
(1601,	'Piccolo 24.09',	'piccolo-24-09',	'2012-09-25 11:43:13',	'2012-09-25 11:43:21',	'0',	'/1601.ipa',	'',	'',	'',	1549,	0,	0,	'',	'',	'',	'http://-alt.mobgen.com',	1,	0,	1,	'com.piccolo.bookstore.world',	'qgalwsonuoaz',	0,	NULL,	1,	1348566193,	1348566201),
(1602,	'Menu build',	'menu-build',	'2012-09-25 15:12:30',	'2012-09-26 15:29:25',	'0',	'/1602.ipa',	'',	'',	'',	1810,	0,	0,	'debug',	'',	'',	'http://-alt.mobgen.com',	1,	0,	0,	'com.mobgen.redevco.app',	'fw0465fdjic9',	0,	NULL,	1,	1348578750,	1348666165),
(1603,	'ABN Research Light 1.3',	'abn-research-light-1-3',	'2012-09-25 17:51:17',	'2012-09-25 17:52:49',	'0',	'/1603.ipa',	'1.3 beta',	'',	'',	1807,	0,	0,	'debug',	'',	'',	'http://-alt.mobgen.com',	1,	0,	0,	'com.mobgen.abn.privatebankinglight',	'bd2kloxs8h80',	0,	NULL,	1,	1348588277,	1348588369),
(1604,	'27.09.Morning',	'27-09-morning',	'2012-09-27 09:31:51',	'2012-09-27 09:31:51',	'0',	'/1604.ipa',	'0.91',	'',	'',	1810,	0,	0,	'debug',	'',	'',	'http://-alt.mobgen.com',	1,	0,	0,	'com.mobgen.redevco.app',	'2sq5c5v7ddgy',	0,	NULL,	1,	1348731111,	1348731111),
(1605,	'ABN Research Light 1.4',	'abn-research-light-1-4',	'2012-09-27 14:23:46',	'2012-09-27 14:23:46',	'0',	'/1605.ipa',	'1.4 beta',	'',	'',	1807,	0,	0,	'debug',	'',	'',	'http://-alt.mobgen.com',	1,	0,	0,	'com.mobgen.abn.privatebankinglight',	'o5qd16eqpfbk',	0,	NULL,	1,	1348748626,	1348748626),
(1606,	'2012-09-28',	'2012-09-28',	'2012-09-28 13:07:20',	'2012-09-28 13:07:20',	'0',	'/1606.ipa',	'',	'',	'',	1810,	0,	0,	'debug',	'',	'',	'http://-alt.mobgen.com',	1,	0,	0,	'com.mobgen.redevco.app',	'mh144i8e712d',	0,	NULL,	1,	1348830440,	1348830440),
(1607,	'VL 2012-09-28 Beta 1.9',	'vl-2012-09-28-beta-1-9',	'2012-09-28 15:23:41',	'2012-09-28 15:23:41',	'0',	'/1607.ipa',	'',	'',	'Fixed login with POST request',	2680,	0,	0,	'debug',	'',	'',	'http://-alt.mobgen.com',	1,	0,	0,	'com.mobgen.vanlanschot',	'zuxjneapx6kx',	0,	NULL,	1,	1348838621,	1348838621),
(1608,	'2012-10-01',	'2012-10-01',	'2012-10-01 09:37:22',	'2012-10-01 16:08:50',	'0',	'/1608.ipa',	'0.94',	'',	'',	1810,	0,	0,	'debug',	'',	'',	'http://-alt.mobgen.com',	1,	0,	0,	'com.mobgen.redevco.app',	'rrga38sp7vco',	0,	NULL,	1,	1349077042,	1349100530),
(1609,	'Audio beta 4',	'audio-beta-4',	'2012-10-01 13:42:45',	'2012-10-01 13:42:54',	'0',	'/1609.ipa',	'',	'',	'Pointing to     return @\"http://abnmagapi-alt.mobgen.com/api\";\r\n\r\nBuilt with ios 5 SDK',	1809,	0,	0,	'debug',	'',	'',	'http://-alt.mobgen.com',	1,	0,	0,	'com.mobgen.abn.publicationapp',	'zj9abnt1r6y4',	0,	NULL,	1,	1349091765,	1349091774),
(1610,	'Shell Innovation iOS6',	'shell-innovation-ios6',	'2012-10-01 15:42:31',	'2012-10-01 16:10:58',	'0',	'/1610.ipa',	'iOS6',	'',	'',	1035,	0,	0,	'Alternative',	'apple@mobgen.com',	'',	'http://shellinnoalt.mobgen.com',	1,	0,	0,	'com.mobgen.shellinnovation',	'7ruslom0xjw',	0,	NULL,	1,	1349098951,	1349100658),
(1611,	'ABN Research Light 1.7',	'abn-research-light-1-7',	'2012-10-02 11:11:25',	'2012-10-02 17:16:07',	'0',	'/1611.ipa',	'1.7 beta',	'',	'',	1807,	0,	0,	'debug',	'',	'',	'http://-alt.mobgen.com',	1,	0,	0,	'com.mobgen.abn.privatebankinglight',	'a5n1qyy43o1m',	0,	NULL,	1,	1349169085,	1349190967),
(1612,	'Shell IR',	'shell-ir',	'2012-10-03 16:16:06',	'2012-10-03 16:16:19',	'0',	'/1612.apk',	'1.5.5_179',	'',	'No crash on 2.2',	1292,	0,	0,	'Production',	'',	'',	'http://-alt.mobgen.com',	1,	1,	0,	'com.mobgen.shellir',	'btzgu3ulmm0j',	0,	NULL,	1,	1349273766,	1349273779),
(1614,	'IR Retina update',	'ir-retina-update',	'2012-10-04 15:27:40',	'2012-10-05 10:14:15',	'0',	'/1614.ipa',	'1.3_345',	'',	'RC 1 IR retina update +iOS 6 ',	1292,	0,	0,	'Production',	'apple@mobgen.com',	'',	'http://-alt.mobgen.com',	1,	0,	0,	'com.mobgen.shellinvestormedia',	'lx3zq6g9oth',	0,	NULL,	1,	1349357260,	1349424855),
(1615,	'ABN Research Light 1.8',	'abn-research-light-1-8',	'2012-10-04 16:43:57',	'2012-10-04 16:43:57',	'0',	'/1615.ipa',	'1.8 beta',	'',	'',	1807,	0,	0,	'debug',	'',	'',	'http://-alt.mobgen.com',	1,	0,	0,	'com.mobgen.abn.privatebankinglight',	'w30b6vok2ig3',	0,	NULL,	1,	1349361837,	1349361837),
(1616,	'Sharing test',	'sharing-test',	'2012-10-05 11:14:00',	'2012-10-05 11:14:00',	'0',	'/1616.ipa',	'',	'',	'Updated sharekit library',	1809,	0,	0,	'debug',	'',	'',	'http://-alt.mobgen.com',	1,	0,	0,	'com.mobgen.abn.publicationapp',	'h6ajdih0zvtm',	0,	NULL,	1,	1349428440,	1349428440),
(1617,	'ABN Research Light 1.0 RC 1 ',	'abn-research-light-1-0-rc-1',	'2012-10-05 12:30:09',	'2012-10-05 12:30:09',	'0',	'/1617.ipa',	'1.0 RC 1',	'',	'',	1807,	0,	0,	'debug',	'',	'',	'http://-alt.mobgen.com',	1,	0,	0,	'com.mobgen.abn.privatebankinglight',	'rpecta7tbuk6',	0,	NULL,	1,	1349433009,	1349433009),
(1618,	'Rhinetex v11',	'rhinetex-v11',	'2012-10-05 15:02:41',	'2012-10-05 15:02:41',	'0',	'/1618.ipa',	'11',	'',	'New XML structure and queries',	1806,	0,	0,	'',	'apple@mobgen.com',	'',	'http://-alt.mobgen.com',	1,	0,	0,	'com.mobgen.mbs.rhinetex',	'emb6tojgwnov',	0,	NULL,	1,	1349442161,	1349442161),
(1619,	'ShellIR-1.5_181',	'shellir-1-5-181',	'2012-10-05 16:47:31',	'2012-10-23 16:02:36',	'0',	'/1619.apk',	'1.5_181',	'',	'launche icon name typo fixed',	1292,	0,	0,	'Production',	'',	'',	'http://-alt.mobgen.com',	1,	1,	0,	'com.mobgen.shellir',	'kxpp7l0to2mm',	0,	NULL,	1,	1349448451,	1351000956),
(1620,	'Shell IE Dev',	'shell-ie-dev',	'2012-10-08 11:29:55',	'2012-10-08 15:35:42',	'2',	'/1620.ipa',	'',	'',	'',	1035,	0,	0,	'Development',	'apple@mobgen.com',	'',	'http://-alt.mobgen.com',	1,	0,	0,	'com.mobgen.shellinnovation',	'h1ou15yiadgf',	0,	NULL,	1,	1349688595,	1349703342),
(1621,	'Rhinetex v13',	'rhinetex-v13',	'2012-10-09 11:22:03',	'2012-10-09 11:22:03',	'0',	'/1621.ipa',	'13',	'',	'Changed brand window background image (no needle) and added support for article group naming.',	1806,	0,	0,	'',	'apple@mobgen.com',	'',	'http://-alt.mobgen.com',	1,	0,	0,	'com.mobgen.mbs.rhinetex',	'y6jnva7s0fcw',	0,	NULL,	1,	1349774523,	1349774523),
(1622,	'ABN RC 2',	'abn-rc-2',	'2012-10-10 14:38:49',	'2012-10-10 14:38:49',	'0',	'/1622.ipa',	'',	'',	'',	1809,	0,	0,	'debug',	'',	'',	'http://-alt.mobgen.com',	1,	0,	0,	'com.mobgen.abn.publicationapp',	'4hd5lclb1by1',	0,	NULL,	1,	1349872729,	1349872729),
(1623,	'KIA',	'kia',	'2012-10-10 15:22:00',	'2012-10-10 16:50:10',	'0',	'/1623.ipa',	'',	'',	'Car IDs changed',	1305,	0,	0,	'debug',	'',	'',	'http://-alt.mobgen.com',	1,	0,	0,	'com.mobgen.kia-presenter',	'wi23srl4uffv',	0,	NULL,	1,	1349875320,	1349880610),
(1624,	'KIA ',	'kia',	'2012-10-11 13:35:35',	'2012-10-11 13:35:35',	'0',	'/1624.ipa',	'',	'',	'added car images for selection gallery',	1305,	0,	0,	' release',	'',	'',	'http://-alt.mobgen.com',	1,	0,	0,	'com.mobgen.kia-presenter',	'yr6t87d1ngoj',	0,	NULL,	1,	1349955335,	1349955335),
(1625,	'ABx',	'abx',	'2012-10-12 10:53:34',	'2012-10-12 10:53:34',	'0',	'/1625.ipa',	'',	'',	'',	1805,	0,	0,	'debug',	'',	'',	'http://-alt.mobgen.com',	1,	0,	0,	'com.abnamro.insights',	'nfdgz4k8pdvn',	0,	NULL,	1,	1350032014,	1350032014),
(1626,	'Rhinetex v15',	'rhinetex-v15',	'2012-10-16 16:42:48',	'2012-10-16 16:42:48',	'0',	'/1626.ipa',	'15',	'',	'',	1806,	0,	0,	'',	'apple@mobgen.com',	'',	'http://-alt.mobgen.com',	1,	0,	0,	'com.mobgen.mbs.rhinetex',	'nbafy0jytyz',	0,	NULL,	1,	1350398568,	1350398568),
(1628,	'ABN Research Light 1.0 RC 3',	'abn-research-light-1-0-rc-3',	'2012-10-18 10:53:58',	'2012-10-18 10:53:58',	'0',	'/1628.ipa',	'1.0 RC 3',	'',	'',	1807,	0,	0,	'debug',	'',	'',	'http://-alt.mobgen.com',	1,	0,	0,	'com.mobgen.abn.privatebankinglight',	'm8kzigpjzhlx',	0,	NULL,	1,	1350550438,	1350550438),
(1629,	'Moda v1',	'moda-v1',	'2012-10-18 13:43:07',	'2012-10-18 13:43:07',	'0',	'/1629.ipa',	'1',	'',	'',	1806,	0,	0,	'',	'apple@mobgen.com',	'',	'http://-alt.mobgen.com',	1,	0,	0,	'com.mobgen.mbs.rhinetex.moda',	'7ldx3x0v5ddc',	0,	NULL,	1,	1350560587,	1350560587),
(1630,	'Who is Who',	'who-is-who',	'2012-10-22 11:18:47',	'2012-10-26 16:05:15',	'0',	'/1630.apk',	'0.1',	'',	'',	1294,	0,	0,	' Android',	'',	'',	'http://-alt.mobgen.com',	1,	1,	0,	'com.mobgen.whoiswho',	'ktss8gampkh',	0,	NULL,	1,	1350897527,	1351260315),
(1631,	'KIA New Imagery',	'kia-new-imagery',	'2012-10-23 10:39:18',	'2012-10-23 10:39:18',	'0',	'/1631.ipa',	'',	'',	'Applied new imagery from kia. Use picanto car with alice blue color.',	1305,	0,	0,	'debug',	'',	'',	'http://-alt.mobgen.com',	1,	0,	0,	'com.mobgen.kia-presenter',	'bdlx8j4hagtn',	0,	NULL,	1,	1350981558,	1350981558),
(1632,	'Shell_InvestorMedia_1.5_181',	'shell-investormedia-1-5-181',	'2012-10-23 18:03:06',	'2012-10-23 18:03:26',	'0',	'/1632.apk',	'',	'',	'From Shell',	1292,	0,	0,	'Production',	'',	'',	'http://-alt.mobgen.com',	1,	1,	0,	'com.mobgen.shellir',	'yq1gxamqgkua',	0,	NULL,	1,	1351008186,	1351008206),
(1634,	'ABN Research Light 1.0 RC 5',	'abn-research-light-1-0-rc-5',	'2012-10-25 09:27:10',	'2012-10-25 15:02:14',	'0',	'/1634.ipa',	'1.0 RC 5',	'',	'',	1807,	0,	0,	'debug',	'',	'',	'http://-alt.mobgen.com',	1,	0,	0,	'com.mobgen.abn.privatebankinglight',	'vynnyle1d6ap',	0,	NULL,	1,	1351150030,	1351170134),
(1635,	'Shell IR',	'shell-ir',	'2012-10-25 17:53:03',	'2012-10-25 17:53:03',	'0',	'/1635.ipa',	'1.3.1 351',	'',	'',	1292,	0,	0,	'Production',	'',	'',	'http://shell-dev.mobgen.com',	1,	0,	0,	'com.mobgen.shellinvestormedia',	'wka3x4nx9uek',	0,	NULL,	1,	1351180383,	1351180383),
(1636,	'Moda m2',	'moda-m2',	'2012-10-25 22:30:56',	'2012-10-25 22:30:56',	'0',	'/1636.ipa',	'm2',	'',	'',	1806,	0,	0,	'',	'apple@mobgen.com',	'',	'http://-alt.mobgen.com',	1,	0,	0,	'com.mobgen.mbs.rhinetex.moda',	'ivdtuvgx5u6l',	0,	NULL,	1,	1351197056,	1351197056),
(1637,	'ABN Research Light 1.0 RC 6',	'abn-research-light-1-0-rc-6',	'2012-10-26 09:40:35',	'2012-11-20 11:25:57',	'0',	'/1637.ipa',	'1.0 RC 6',	'',	'',	1807,	0,	0,	'debug',	'',	'',	'http://-alt.mobgen.com',	1,	0,	0,	'com.mobgen.abn.privatebankinglight',	'frrglzhc411g',	0,	NULL,	1,	1351237235,	1353407157),
(1638,	'VL Beta 1.19',	'vl-beta-1-19',	'2012-10-29 14:51:02',	'2012-10-29 14:51:02',	'0',	'/1638.ipa',	'',	'',	'Activity indication when loading first screen.\r\nFixed crash with low memory.',	2680,	0,	0,	'debug',	'',	'',	'http://-alt.mobgen.com',	1,	0,	0,	'com.mobgen.vanlanschot',	'dya0bnur6jem',	0,	NULL,	1,	1351518662,	1351518662),
(1639,	'Shell IE ',	'shell-ie',	'2012-10-29 16:29:49',	'2012-10-29 16:29:49',	'2',	'/1639.ipa',	'1.3.24 791',	'',	'',	1035,	0,	0,	'Alternative',	'',	'',	'http://shellinno-alt.mobgen.com',	1,	0,	0,	'com.mobgen.shellinnovation',	'auzdf5tya8g3',	0,	NULL,	1,	1351524589,	1351524589),
(1640,	'NIBE',	'nibe',	'2012-10-29 17:14:49',	'2012-10-29 17:14:49',	'0',	'/1640.ipa',	'0.5',	'',	'',	1302,	0,	0,	'',	'',	'',	'http://-alt.mobgen.com',	1,	0,	0,	'com.mobgen.NIBE',	'9bs7ydwr6pqd',	0,	NULL,	1,	1351527289,	1351527289),
(1642,	'Performance validation',	'performance-validation',	'2012-11-02 14:05:30',	'2012-11-02 14:05:30',	'0',	'/1642.ipa',	'1.2',	'',	'',	1039,	0,	0,	'',	'',	'',	'http://-alt.mobgen.com',	1,	0,	0,	'com.mobgen.eControlForMEibes',	'nmmb1tuqwlda',	0,	NULL,	1,	1351861530,	1351861530),
(1643,	'Shell IE Stage test',	'shell-ie-stage-test',	'2012-11-05 17:01:17',	'2012-11-05 17:03:08',	'0',	'/1643.ipa',	'1.3.24 793',	'',	'',	1035,	0,	0,	'Staging',	'apple@mobgen.com',	'',	'http://shellinno-stage.mobgen.com',	1,	0,	0,	'com.mobgen.shellinnovation',	'ngtz6poewo4j',	0,	NULL,	1,	1352131277,	1352131388),
(1644,	'Rhinetex v22',	'rhinetex-v22',	'2012-11-06 14:57:24',	'2012-11-06 14:57:24',	'0',	'/1644.ipa',	'v22',	'',	'',	1806,	0,	0,	'',	'apple@mobgen.com',	'',	'http://-alt.mobgen.com',	1,	0,	0,	'com.mobgen.mbs.rhinetex',	'ywf50ct4j4vs',	0,	NULL,	1,	1352210244,	1352210244),
(1645,	'Rhinetex v23',	'rhinetex-v23',	'2012-11-06 17:42:59',	'2012-11-06 17:42:59',	'0',	'/1645.ipa',	'v23',	'',	'',	1806,	0,	0,	'',	'apple@mobgen.com',	'',	'http://-alt.mobgen.com',	1,	0,	0,	'com.mobgen.mbs.rhinetex',	'p3aauqsu670g',	0,	NULL,	1,	1352220179,	1352220179),
(1646,	'Asset Viewer 05-11-2012',	'asset-viewer-05-11-2012',	'2012-11-06 17:52:57',	'2012-11-07 12:57:28',	'0',	'/1646.ipa',	'1',	'',	'',	1812,	0,	0,	'',	'apple@mobgen.com',	'',	'http://-alt.mobgen.com',	1,	0,	0,	'com.mobgen.Asset-Viewer-Enterprise',	'35v73qhd3t1',	0,	NULL,	1,	1352220777,	1352289448),
